PT	AU	BA	BE	GP	AF	BF	CA	TI	SO	SE	BS	LA	DT	CT	CY	CL	SP	HO	DE	ID	AB	C1	C3	RP	EM	RI	OI	FU	FP	FX	CR	NR	TC	Z9	U1	U2	PU	PI	PA	SN	EI	BN	J9	JI	PD	PY	VL	IS	PN	SU	SI	MA	BP	EP	AR	DI	DL	D2	EA	PG	WC	WE	SC	GA	PM	OA	HC	HP	DA	UT
J	Ertugrul, IO; Ahn, YA; Bilalpur, M; Messinger, DS; Speltz, ML; Cohn, JF				Ertugrul, Itir Onal; Ahn, Yeojin Amy; Bilalpur, Maneesh; Messinger, Daniel S.; Speltz, Matthew L.; Cohn, Jeffrey			Infant AFAR: Automated facial action recognition in infants	BEHAVIOR RESEARCH METHODS			English	Article; Early Access						Automatic facial action unit detection; Facial action coding system; Infant behavior; Cross domain generalizability; Deep learning	CRANIOFACIAL MICROSOMIA; EXPRESSIONS; FACE; MODELS	Automated detection of facial action units in infants is challenging. Infant faces have different proportions, less texture, fewer wrinkles and furrows, and unique facial actions relative to adults. For these and related reasons, action unit (AU) detectors that are trained on adult faces may generalize poorly to infant faces. To train and test AU detectors for infant faces, we trained convolutional neural networks (CNN) in adult video databases and fine-tuned these networks in two large, manually annotated, infant video databases that differ in context, head pose, illumination, video resolution, and infant age. AUs were those central to expression of positive and negative emotion. AU detectors trained in infants greatly outperformed ones trained previously in adults. Training AU detectors across infant databases afforded greater robustness to between-database differences than did training database specific AU detectors and outperformed previous state-of-the-art in infant AU detection. The resulting AU detection system, which we refer to as Infant AFAR (Automated Facial Action Recognition), is available to the research community for further testing and applications in infant emotion, social interaction, and related topics.	[Ertugrul, Itir Onal] Univ Utrecht, Utrecht, Netherlands; [Ahn, Yeojin Amy; Messinger, Daniel S.] Univ Miami, Miami, FL USA; [Bilalpur, Maneesh; Cohn, Jeffrey] Univ Pittsburgh, Pittsburgh, PA USA; [Speltz, Matthew L.] Univ Washington, Seattle, WA 98195 USA		Ertugrul, IO (corresponding author), Univ Utrecht, Utrecht, Netherlands.	i.onalertugrul@uu.nl			US National Institutes of Health [DE026513, DE022438, MH096951, R01-GM105004-01]; National Science Foundation [1052736]; Center for Clinical and Translational Research at Seattle Children'dss Research Institute [UL1 TR000423]	US National Institutes of Health(United States Department of Health & Human ServicesNational Institutes of Health (NIH) - USA); National Science Foundation(National Science Foundation (NSF)); Center for Clinical and Translational Research at Seattle Children'dss Research Institute	The work was supported in part by US National Institutes of Health grants DE026513, DE022438, MH096951, R01-GM105004-01, National Science Foundation grant 1052736, and the Center for Clinical and Translational Research at Seattle Children'dss Research Institute grant UL1 TR000423.	Adamson LB, 2003, INFANCY, V4, P451, DOI 10.1207/S15327078IN0404_01; Baltrusaitis T, 2018, IEEE INT CONF AUTOMA, P59, DOI 10.1109/FG.2018.00019; Bansal S., 2019, P 2019 C N AM CHAPT, V1, P5868; Barrett LF, 2019, PSYCHOL SCI PUBL INT, V20, P1, DOI 10.1177/1529100619832930; Beebe B, 2020, COMPANION PUBLICATON OF THE 2020 INTERNATIONAL CONFERENCE ON MULTIMODAL INTERACTION (ICMI '20 COMPANION), P365, DOI 10.1145/3395035.3425357; Beebe B, 2013, ATTACH HUM DEV, V15, P583, DOI 10.1080/14616734.2013.841050; BRENNAN RL, 1981, EDUC PSYCHOL MEAS, V41, P687, DOI 10.1177/001316448104100307; Burges CJC, 1998, DATA MIN KNOWL DISC, V2, P121, DOI 10.1023/A:1009715923555; CAMPBELL SB, 1995, DEV PSYCHOL, V31, P349, DOI 10.1037/0012-1649.31.3.349; CAMRAS LA, 1992, COGNITION EMOTION, V6, P269, DOI 10.1080/02699939208411072; Chen JX, 2013, PATTERN RECOGN LETT, V34, P1964, DOI 10.1016/j.patrec.2013.02.002; Chen M, 2021, MULTIVAR BEHAV RES, V56, P739, DOI 10.1080/00273171.2020.1762065; Chu W. S., 2017, FG, P2532; Cohn J. F., 1991, DEV PSYCHOPATHOL, V3, P367, DOI [DOI 10.1017/S0954579400007574, 10.1017/S0954579400007574]; Cohn J.F., 2007, HDB EMOTION ELICITAT, P203, DOI [10.1007/978-3-540-72348-6_1, DOI 10.1007/978-3-540-72348-6_1]; Cohn JF, 2010, BEHAV RES METHODS, V42, P1079, DOI 10.3758/BRM.42.4.1079; Cohn JF., 2005, NEW HDB METHODS NONV, P9; Cootes TF, 2001, IEEE T PATTERN ANAL, V23, P681, DOI 10.1109/34.927467; Cowen AS, 2021, NATURE, V589, P251, DOI 10.1038/s41586-020-3037-7; Deng J., 2009, PROC CVPR IEEE, P248, DOI DOI 10.1109/CVPR.2009.5206848; Eibl-Eibesfeldt I, 1970, ETHOLOGY BIOL BEHAV, P530; Ekman P, 2002, RES NEXUS; Ertugrul Itir Onal, 2020, IEEE Trans Biom Behav Identity Sci, V2, P158, DOI [10.1109/TBIOM.2020.2977225, 10.1109/tbiom.2020.2977225]; Ertugrul Itir Onal, 2019, Proc Int Conf Autom Face Gesture Recognit, V2019, DOI 10.1109/FG.2019.8756623; Forestell Catherine A, 2017, Curr Nutr Rep, V6, P141, DOI 10.1007/s13668-017-0205-y; Girard Jeffrey M., 2015, 2015 11th IEEE International Conference and Workshops on Automatic Face and Gesture Recognition (FG), P1, DOI 10.1109/FG.2015.7163106; Girard JM, 2017, IEEE INT CONF AUTOMA, P581, DOI 10.1109/FG.2017.144; Goldsmith H. H., 1999, LAB TEMPERAMENT ASSE; Hammal Z, 2018, CLEFT PALATE-CRAN J, V55, P711, DOI 10.1177/1055665617753481; Hammal Z, 2017, INT CONF AFFECT, P216, DOI 10.1109/ACII.2017.8273603; Hammal Z, 2015, IEEE T AFFECT COMPUT, V6, P361, DOI 10.1109/TAFFC.2015.2422702; Heike CL, 2016, BIRTH DEFECTS RES A, V106, P915, DOI 10.1002/bdra.23560; HINTON GE, 1992, SCI AM, V267, P145, DOI 10.1038/scientificamerican0992-144; Hsu C.-W., 2008, PRACTICAL GUIDE SUPP; Jeni L. A., 2013, ACII; Jeni LA, 2017, IMAGE VISION COMPUT, V58, P13, DOI 10.1016/j.imavis.2016.05.009; Jiang BH, 2014, IEEE T CYBERNETICS, V44, P161, DOI 10.1109/TCYB.2013.2249063; Kohut SA, 2012, PAIN, V153, P2458, DOI 10.1016/j.pain.2012.09.005; LeCun Y., 2015, NATURE, V521, P436, DOI DOI 10.1038/NATURE14539; Luquetti DV, 2019, CLEFT PALATE-CRAN J, V56, P877, DOI 10.1177/1055665618821014; Mahoor Mohammad H., 2009, 2009 IEEE Computer Society Conference on Computer Vision and Pattern Recognition Workshops (CVPR Workshops), P74, DOI 10.1109/CVPR.2009.5204259; MATIAS R, 1993, DEV PSYCHOL, V29, P524, DOI 10.1037/0012-1649.29.3.524; Matthews I, 2004, INT J COMPUT VISION, V60, P135, DOI 10.1023/B:VISI.0000029666.37597.d3; Mattson WI, 2013, PLOS ONE, V8, DOI 10.1371/journal.pone.0080161; Mesman J, 2009, DEV REV, V29, P120, DOI 10.1016/j.dr.2009.02.001; Messinger DS, 2012, EMOTION, V12, P430, DOI 10.1037/a0026498; Messinger DS, 2009, INFANCY, V14, P285, DOI 10.1080/15250000902839963; Niinuma K., 2019, BMVC; Onal Ertugrul I., 2019, CROSS DOMAIN DETECTI; Ertugrul IO, 2019, FRONT COMP SCI-SWITZ, V1, DOI 10.3389/fcomp.2019.00011; Oster H., 2006, UNPUBLISHED MONOGRAP; Rosenstein D., 1988, CHILD DEV; Saining Xie, 2020, Computer Vision - ECCV 2020. 16th European Conference. Proceedings. Lecture Notes in Computer Science (LNCS 12348), P574, DOI 10.1007/978-3-030-58580-8_34; Simonyan K., 2014, ARXIV; Speltz ML, 2018, J PEDIATR-US, V198, P226, DOI 10.1016/j.jpeds.2018.02.076; Valstar M., 2004, 2004 IEEE INT C SYST, V1; Yang L, 2019, INT CONF AFFECT; Zaker N, 2014, IEEE IMAGE PROC, P1357, DOI 10.1109/ICIP.2014.7025271; Zhao K., 2016, CVPR; Zhou ZW, 2017, PROC CVPR IEEE, P4761, DOI 10.1109/CVPR.2017.506	60	0	0	3	3	SPRINGER	NEW YORK	ONE NEW YORK PLAZA, SUITE 4600, NEW YORK, NY, UNITED STATES	1554-351X	1554-3528		BEHAV RES METHODS	Behav. Res. Methods												10.3758/s13428-022-01863-y	http://dx.doi.org/10.3758/s13428-022-01863-y		MAY 2022	12	Psychology, Mathematical; Psychology, Experimental	Social Science Citation Index (SSCI)	Psychology	1C4JY	35538295	hybrid			2022-10-03	WOS:000793088700002
J	Cohn, JF; Motta, M; Parrish, RM				Cohn, Jeffrey; Motta, Mario; Parrish, Robert M.			Quantum Filter Diagonalization with Compressed Double-Factorized Hamiltonians	PRX QUANTUM			English	Article							APPROXIMATE INTEGRALS; DECOMPOSITION; ALGORITHM	We demonstrate a method that merges the quantum filter diagonalization (QFD) approach for hybrid quantum-classical solution of the time-independent electronic Schrodinger equation with a low-rank double factorization (DF) approach for the representation of the electronic Hamiltonian. In particular, we explore the use of a novel sparse "compressed" double factorization (C-DF) truncation of the Hamiltonian within the time-propagation elements of QFD, while retaining a similarly compressed but numerically converged double-factorized representation of the Hamiltonian for the operator expectation values needed in the QFD quantum matrix elements. The new C-DF method is found to provide substantial additional compression at any given accuracy metric over the traditional "explicit" double factorization approach. Together with significant circuit reduction optimizations and number-preserving postselection and echosequencing error mitigation strategies, the method is found to provide accurate predictions for low-lying eigenspectra in a number of representative molecular systems, while requiring reasonably short circuit depths and modest measurement costs. The method is demonstrated by experiments on noise-free simulators, simulations including models of decoherence and shot-noise, and real quantum hardware.	[Cohn, Jeffrey; Motta, Mario] IBM Res Almaden, IBM Quantum, San Jose, CA 95120 USA; [, Robert M.] QC Ware Corp, Palo Alto, CA 94301 USA		Cohn, JF (corresponding author), IBM Res Almaden, IBM Quantum, San Jose, CA 95120 USA.	jeffrey.cohn@ibm.com; mario.motta@ibm.com; rob.parrish@qcware.com	Motta, Mario/AHD-9813-2022		U.S. Department of Energy, Office of Science, Basic Energy Sciences, Chemical Sciences, Geosciences and Biosciences Division	U.S. Department of Energy, Office of Science, Basic Energy Sciences, Chemical Sciences, Geosciences and Biosciences Division(United States Department of Energy (DOE))	The QC Ware effort in this work was supported by the U.S. Department of Energy, Office of Science, Basic Energy Sciences, Chemical Sciences, Geosciences and Biosciences Division. We thank an anonymous reviewer for a suggestion to more thoroughly explore the error characteristics of X-DF versus C-DF in the context of deviations in chemically important observables such as total adiabatic state energies.	Aharonov D., 2006, STOC'06. Proceedings of the 38th Annual ACM Symposium on Theory of Computing, P427; Aleksandrowicz G., 2019, ZENODO; Aquilante F, 2007, J CHEM PHYS, V126, DOI 10.1063/1.2736701; Aquilante F, 2009, J CHEM PHYS, V130, DOI 10.1063/1.3116784; Beebe NHF, 1977, INT J QUANTUM CHEM, V12, P683, DOI 10.1002/qua.560120408; Berry DW, 2019, QUANTUM-AUSTRIA, V3, DOI 10.22331/q-2019-12-02-208; Bonet-Monroig X, 2018, PHYS REV A, V98, DOI 10.1103/PhysRevA.98.062339; Bravyi SB, 2002, ANN PHYS-NEW YORK, V298, P210, DOI 10.1006/aphy.2002.6254; Cross AW, 2019, PHYS REV A, V100, DOI 10.1103/PhysRevA.100.032328; DUNLAP BI, 1977, INT J QUANTUM CHEM, P81; DUNLAP BI, 1979, J CHEM PHYS, V71, P3396, DOI 10.1063/1.438728; FEYEREISEN M, 1993, CHEM PHYS LETT, V208, P359, DOI 10.1016/0009-2614(93)87156-W; Georgescu IM, 2014, REV MOD PHYS, V86, P153, DOI 10.1103/RevModPhys.86.153; Gokhale P., 2020, IEEE T QUANTUM ENG, V1, P1; Google Al Quantum Collaborators, 2020, SCIENCE, V369, P1084, DOI 10.1126/science.abb9811; HEADGORDON M, 1988, J PHYS CHEM-US, V92, P3063, DOI 10.1021/j100322a012; Hohenstein EG, 2012, J CHEM PHYS, V137, DOI 10.1063/1.4732310; Huggins WJ, 2021, NPJ QUANTUM INFORM, V7, DOI 10.1038/s41534-020-00341-7; Huggins WJ, 2020, NEW J PHYS, V22, DOI 10.1088/1367-2630/ab867b; Kempe J, 2006, SIAM J COMPUT, V35, P1070, DOI 10.1137/S0097539704445226; Kendall RA, 1997, THEOR CHEM ACC, V97, P158, DOI 10.1007/s002140050249; Kivlichan ID, 2018, PHYS REV LETT, V120, DOI 10.1103/PhysRevLett.120.110501; Klymko K., 2021, ARXIV210308563; Koch H, 2003, J CHEM PHYS, V118, P9481, DOI 10.1063/1.1578621; KOMORNICKI A, 1993, J CHEM PHYS, V98, P1398, DOI 10.1063/1.465054; Lee J., 2020, ARXIV201103494; Matsuzawa Y, 2020, J CHEM THEORY COMPUT, V16, P944, DOI 10.1021/acs.jctc.9b00963; McArdle S, 2019, PHYS REV LETT, V122, DOI 10.1103/PhysRevLett.122.180501; McClean JR, 2017, PHYS REV A, V95, DOI 10.1103/PhysRevA.95.042308; Motta M., 2018, ARXIV180802625; Motta M, 2020, NAT PHYS, V16, P205, DOI 10.1038/s41567-019-0704-4; Motta M, 2019, J CHEM THEORY COMPUT, V15, P3510, DOI 10.1021/acs.jctc.8b00996; Nakanishi KM, 2019, PHYS REV RES, V1, DOI 10.1103/PhysRevResearch.1.033062; NEUHAUSER D, 1994, J CHEM PHYS, V100, P5076, DOI 10.1063/1.467224; NEUHAUSER D, 1990, J CHEM PHYS, V93, P2611, DOI 10.1063/1.458900; Ollitrault PJ, 2020, PHYS REV RES, V2, DOI 10.1103/PhysRevResearch.2.043140; Olsen, 2013, MOL ELECT STRUCTURE; Parrish R. M., 2019, ARXIV190908925; Parrish RM, 2019, PHYS REV LETT, V122, DOI 10.1103/PhysRevLett.122.230401; Parrish RM, 2013, PHYS REV LETT, V111, DOI 10.1103/PhysRevLett.111.132505; Parrish RM, 2012, J CHEM PHYS, V137, DOI 10.1063/1.4768233; Peng B, 2017, J CHEM THEORY COMPUT, V13, P4179, DOI 10.1021/acs.jctc.7b00605; Peruzzo A, 2014, NAT COMMUN, V5, DOI 10.1038/ncomms5213; Poulin D, 2015, QUANTUM INF COMPUT, V15, P361; RECK M, 1994, PHYS REV LETT, V73, P58, DOI 10.1103/PhysRevLett.73.58; RENDELL AP, 1994, J CHEM PHYS, V101, P400, DOI 10.1063/1.468148; ROEGGEN I, 1986, CHEM PHYS LETT, V132, P154, DOI 10.1016/0009-2614(86)80099-9; Stair NH, 2020, J CHEM THEORY COMPUT, V16, P2236, DOI 10.1021/acs.jctc.9b01125; Tran MC, 2021, PRX QUANTUM, V2, DOI 10.1103/PRXQuantum.2.010323; VAHTRAS O, 1993, CHEM PHYS LETT, V213, P514, DOI 10.1016/0009-2614(93)89151-7; Verteletskyi V, 2020, J CHEM PHYS, V152, DOI 10.1063/1.5141458; von Burg V., 2020, ARXIV200714460; Wecker D, 2015, PHYS REV A, V92, DOI 10.1103/PhysRevA.92.062318; Weigend F, 2002, PHYS CHEM CHEM PHYS, V4, P4285, DOI 10.1039/b204199p; WHITTEN JL, 1973, J CHEM PHYS, V58, P4496, DOI 10.1063/1.1679012; WILCOX RM, 1967, J MATH PHYS, V8, P962, DOI 10.1063/1.1705306	56	2	2	2	2	AMER PHYSICAL SOC	COLLEGE PK	ONE PHYSICS ELLIPSE, COLLEGE PK, MD 20740-3844 USA		2691-3399		PRX QUANTUM	PRX Quantum	DEC 15	2021	2	4							040352	10.1103/PRXQuantum.2.040352	http://dx.doi.org/10.1103/PRXQuantum.2.040352			19	Quantum Science & Technology; Physics, Applied; Physics, Multidisciplinary	Science Citation Index Expanded (SCI-EXPANDED)	Physics	YI9XP		gold, Green Submitted			2022-10-03	WOS:000744194200001Parrish
