PT	AU	BA	BE	GP	AF	BF	CA	TI	SO	SE	BS	LA	DT	CT	CY	CL	SP	HO	DE	ID	AB	C1	C3	RP	EM	RI	OI	FU	FP	FX	CR	NR	TC	Z9	U1	U2	PU	PI	PA	SN	EI	BN	J9	JI	PD	PY	VL	IS	PN	SU	SI	MA	BP	EP	AR	DI	DL	D2	EA	PG	WC	WE	SC	GA	PM	OA	HC	HP	DA	UT
C	Ertugrul, IO; Jeni, LA; Cohn, JF			IEEE	Ertugrul, Itir Onal; Jeni, Laszlo A.; Cohn, Jeffrey			FACSCaps: Pose-Independent Facial Action Coding with Capsules	PROCEEDINGS 2018 IEEE/CVF CONFERENCE ON COMPUTER VISION AND PATTERN RECOGNITION WORKSHOPS (CVPRW)	IEEE Computer Society Conference on Computer Vision and Pattern Recognition Workshops		English	Proceedings Paper	IEEE/CVF Conference on Computer Vision and Pattern Recognition (CVPR)	JUN 18-22, 2018	Salt Lake City, UT	IEEE Comp Soc				Most automated facial expression analysis methods treat the face as a 2D object, flat like a sheet of paper. That works well provided images are frontal or nearly so. In real-world conditions, moderate to large head rotation is common and system performance to recognize expression degrades. Multi-view Convolutional Neural Networks (CNNs) have been proposed to increase robustness to pose, but they require greater model sizes and may generalize poorly across views that are not included in the training set. We propose FACSCaps architecture to handle multi-view and multi-label facial action unit (AU) detection within a single model that can generalize to novel views. Additionally, FACSCaps's ability to synthesize faces enables insights into what is leaned by the model. FACSCaps models video frames using matrix capsules, where hierarchical pose relationships between face parts are built into internal representations. The model is trained by jointly optimizing a multi-label loss and the reconstruction accuracy. FACSCaps was evaluated using the FERA 2017 facial expression dataset that includes spontaneous facial expressions in a wide range of head orientations. FACSCaps outperformed both state-of-the-art CNNs and their temporal extensions.	[Ertugrul, Itir Onal; Jeni, Laszlo A.; Cohn, Jeffrey] Carnegie Mellon Univ, Robot Inst, Pittsburgh, PA 15213 USA; [Cohn, Jeffrey] Univ Pittsburgh, Dept Psychol, Pittsburgh, PA 15260 USA		Ertugrul, IO (corresponding author), Carnegie Mellon Univ, Robot Inst, Pittsburgh, PA 15213 USA.	iertugru@andrew.cmu.edu; laszlojeni@cmu.edu; jeffcohn@pitt.edu			National Institute of Mental Health of the National Institutes of Health [MH096951]; NATIONAL INSTITUTE OF MENTAL HEALTH [R01MH096951] Funding Source: NIH RePORTER	National Institute of Mental Health of the National Institutes of Health(United States Department of Health & Human ServicesNational Institutes of Health (NIH) - USANIH National Institute of Mental Health (NIMH)); NATIONAL INSTITUTE OF MENTAL HEALTH(United States Department of Health & Human ServicesNational Institutes of Health (NIH) - USANIH National Institute of Mental Health (NIMH))	Preparation of this article was supported in part by the National Institute of Mental Health of the National Institutes of Health under Award Number MH096951.	AFSHAR P, 2018, ARXIV180210200; Andersen P., 2018, ARXIV180109597; [Anonymous], 2017, ARXIV171203480; Baltrusaitis T., 2016, 2016 IEEE WINT C APP, P1, DOI [10.1109/WACV.2016.7477553, DOI 10.1109/WACV.2016.7477553]; Batista JC, 2017, IEEE INT CONF AUTOMA, P866, DOI 10.1109/FG.2017.111; Chu WS, 2017, IEEE INT CONF AUTOMA, P25, DOI 10.1109/FG.2017.13; Chu WS, 2017, IEEE T PATTERN ANAL, V39, P529, DOI 10.1109/TPAMI.2016.2547397; Eleftheriadis S., 2016, P IEEE C COMP VIS PA, P18; Eleftheriadis S, 2015, IEEE I CONF COMP VIS, P3792, DOI 10.1109/ICCV.2015.432; Ghosh S, 2015, INT CONF AFFECT, P609, DOI 10.1109/ACII.2015.7344632; Gudi, 2015, AUT FAC GEST REC FG, P1, DOI DOI 10.1109/FG.2015.7284873; He J, 2017, IEEE INT CONF AUTOMA, P848, DOI 10.1109/FG.2017.108; Higgins I, 2017, ICLR; Hinton G., 2018, MATRIX CAPSULES EM R; Jaiswal A., 2018, ARXIV180206167; Jaiswal Shashank, 2016, WACV; Kingma D.P., 2015, ARXIV; Kulkarni TD, 2015, ADV NEUR IN, V28; Li XR, 2017, IEEE INT CONF AUTOMA, P860, DOI 10.1109/FG.2017.110; Li YQ, 2013, IEEE T AFFECT COMPUT, V4, P127, DOI 10.1109/T-AFFC.2013.5; Lucey S., 2007, FACE RECOGNITION; Sabour S., 2017, NEURIPS, P3856; Sariyanidi E, 2015, IEEE T PATTERN ANAL, V37, P1113, DOI 10.1109/TPAMI.2014.2366127; Senechal T, 2012, IEEE T SYST MAN CY B, V42, P993, DOI 10.1109/TSMCB.2012.2193567; Tang CG, 2017, IEEE INT CONF AUTOMA, P878, DOI 10.1109/FG.2017.113; Tian YI, 2001, IEEE T PATTERN ANAL, V23, P97, DOI 10.1109/34.908962; Tian YL, 2005, HANDBOOK OF FACE RECOGNITION, P247, DOI 10.1007/0-387-27257-7_12; Toser Z, 2016, LECT NOTES COMPUT SC, V9915, P359, DOI 10.1007/978-3-319-49409-8_29; Tran D. Linh, 2017, P IEEE C COMP VIS PA, P3190; Valstar MF, 2017, IEEE INT CONF AUTOMA, P839, DOI 10.1109/FG.2017.107; Wang Y., 2018, SENTIMENT ANAL CAPSU; Wang ZH, 2013, IEEE I CONF COMP VIS, P3304, DOI 10.1109/ICCV.2013.410; Zeiler MD, 2014, LECT NOTES COMPUT SC, V8689, P818, DOI 10.1007/978-3-319-10590-1_53; Zhang X, 2016, PATTERN RECOGN, V51, P187, DOI 10.1016/j.patcog.2015.08.026; Zhang X, 2014, IMAGE VISION COMPUT, V32, P692, DOI 10.1016/j.imavis.2014.06.002; Zhang Z, 2016, PROC CVPR IEEE, P3438, DOI 10.1109/CVPR.2016.374; Zhao KL, 2016, PROC CVPR IEEE, P3391, DOI 10.1109/CVPR.2016.369; Zhao KL, 2015, PROC CVPR IEEE, P2207, DOI 10.1109/CVPR.2015.7298833	38	11	11	0	5	IEEE	NEW YORK	345 E 47TH ST, NEW YORK, NY 10017 USA	2160-7508		978-1-5386-6100-0	IEEE COMPUT SOC CONF			2018							2211	2220		10.1109/CVPRW.2018.00287	http://dx.doi.org/10.1109/CVPRW.2018.00287			10	Computer Science, Artificial Intelligence	Conference Proceedings Citation Index - Science (CPCI-S)	Computer Science	BL9LT	30944768	Green Accepted			2022-10-03	WOS:000457636800280
C	Kacem, A; Hammal, Z; Daoudi, M; Cohn, JF			IEEE	Kacem, Anis; Hammal, Zakia; Daoudi, Mohamed; Cohn, Jeffrey			Detecting Depression Severity by Interpretable Representations of Motion Dynamics	PROCEEDINGS 2018 13TH IEEE INTERNATIONAL CONFERENCE ON AUTOMATIC FACE & GESTURE RECOGNITION (FG 2018)	IEEE International Conference on Automatic Face and Gesture Recognition and Workshops		English	Proceedings Paper	13th IEEE International Conference on Automatic Face & Gesture Recognition (FG)	MAY 15-19, 2018	Xi an, PEOPLES R CHINA	IEEE Comp Soc, IEEE Biometr Council			SCALE	Recent breakthroughs in deep learning using automated measurement of face and head motion have made possible the first objective measurement of depression severity. While powerful, deep learning approaches lack interpretability. We developed an interpretable method of automatically measuring depression severity that uses barycentric coordinates of facial landmarks and a Lie-algebra based rotation matrix of 3D head motion. Using these representations, kinematic features are extracted, preprocessed, and encoded using Gaussian Mixture Models (GMM) and Fisher vector encoding. A multi-class SVM is used to classify the encoded facial and head movement dynamics into three levels of depression severity. The proposed approach was evaluated in adults with history of chronic depression. The method approached the classification accuracy of state-of-the-art deep learning while enabling clinically and theoretically relevant findings. The velocity and acceleration of facial movement strongly mapped onto depression severity symptoms consistent with clinical data and theory.	[Kacem, Anis; Daoudi, Mohamed] Univ Lille, CNRS, IMT Lille Douai, CRIStAL,UMR 9189, F-59000 Lille, France; [Hammal, Zakia; Cohn, Jeffrey] Carnegie Mellon Univ, Robot Inst, Pittsburgh, PA 15213 USA; [Cohn, Jeffrey] Univ Pittsburgh, Dept Psychol, Pittsburgh, PA 15260 USA		Kacem, A (corresponding author), Univ Lille, CNRS, IMT Lille Douai, CRIStAL,UMR 9189, F-59000 Lille, France.				U.S. National Institute Of Nursing Research of the National Institutes of Health [R21NR016510]; U.S. National Institute of Mental Health of the National Institutes of Health [MH096951]; U.S. National Science Foundation [IIS-1721667]; NATIONAL INSTITUTE OF MENTAL HEALTH [R01MH096951] Funding Source: NIH RePORTER; NATIONAL INSTITUTE OF NURSING RESEARCH [R21NR016510] Funding Source: NIH RePORTER	U.S. National Institute Of Nursing Research of the National Institutes of Health; U.S. National Institute of Mental Health of the National Institutes of Health(United States Department of Health & Human ServicesNational Institutes of Health (NIH) - USANIH National Institute of Mental Health (NIMH)); U.S. National Science Foundation(National Science Foundation (NSF)); NATIONAL INSTITUTE OF MENTAL HEALTH(United States Department of Health & Human ServicesNational Institutes of Health (NIH) - USANIH National Institute of Mental Health (NIMH)); NATIONAL INSTITUTE OF NURSING RESEARCH(United States Department of Health & Human ServicesNational Institutes of Health (NIH) - USANIH National Institute of Nursing Research (NINR))	We thank J-C. Alvarez Paiva for fruitful discussions on barycentric coordinate representation. Research reported in this publication was supported in part by the U.S. National Institute Of Nursing Research of the National Institutes of Health under Award Number R21NR016510, the U.S. National Institute of Mental Health of the National Institutes of Health under Award Number MH096951, and the U.S. National Science Foundation under award IIS-1721667. The content is solely the responsibility of the authors and does not necessarily represent the official views of the sponsors.	Alghowinem S, 2013, INT CONF AFFECT, P283, DOI 10.1109/ACII.2013.53; BECK AT, 1961, ARCH GEN PSYCHIAT, V4, P561, DOI 10.1001/archpsyc.1961.01710120031004; Begelfor E., 2006, P IEEE C COMP VIS PA, V2, P2087, DOI DOI 10.1109/CVPR.2006.50; Berger M., 1987, GEOMETRY, Vi; Boas ML, 2006, MATH METHODS PHYS SC; COHEN J, 1968, PSYCHOL BULL, V70, P213, DOI 10.1037/h0026256; Cohn J. F., 2009, 2009 3 INT C AFF COM, DOI 10.1109/ACII.2009.5349358; Dibeklioglu H., 2017, IEEE J BIOMEDICAL HL; Dibeklioglu H, 2015, ICMI'15: PROCEEDINGS OF THE 2015 ACM INTERNATIONAL CONFERENCE ON MULTIMODAL INTERACTION, P307, DOI 10.1145/2818346.2820776; EKMAN P, 1980, J PERS SOC PSYCHOL, V39, P1125, DOI 10.1037/h0077722; FISCH HU, 1983, J ABNORM PSYCHOL, V92, P307, DOI 10.1037/0021-843X.92.3.307; Fournier JC, 2010, JAMA-J AM MED ASSOC, V303, P47, DOI 10.1001/jama.2009.1943; Girard JM, 2014, IMAGE VISION COMPUT, V32, P641, DOI 10.1016/j.imavis.2013.12.007; HAMILTON M, 1960, J NEUROL NEUROSUR PS, V23, P56, DOI 10.1136/jnnp.23.1.56; Jayasumana S, 2013, IEEE I CONF COMP VIS, P1249, DOI 10.1109/ICCV.2013.158; Jeni LA, 2017, IMAGE VISION COMPUT, V58, P13, DOI 10.1016/j.imavis.2016.05.009; Joshi J, 2013, J MULTIMODAL USER IN, V7, P1; Kacem A., 2017, INT C COMP VIS; Kacem A, 2018, IEEE INT C AUT FAC G; Peng HC, 2005, IEEE T PATTERN ANAL, V27, P1226, DOI 10.1109/TPAMI.2005.159; Perronnin F, 2010, LECT NOTES COMPUT SC, V6314, P143, DOI 10.1007/978-3-642-15561-1_11; Renneberg B, 2005, J BEHAV THER EXP PSY, V36, P183, DOI 10.1016/j.jbtep.2005.05.002; Rottenberg J, 2005, J ABNORM PSYCHOL, V114, P627, DOI 10.1037/0021-843X.114.4.627; Saragih J., 2006, PATT REC 2006 ICPR 2, V2, P1196; Schwartz G. E., 1976, PSYCHOSOMATIC MED; Taheri S, 2011, Proceedings 2011 IEEE International Conference on Automatic Face & Gesture Recognition (FG 2011), P306, DOI 10.1109/FG.2011.5771415; Valstar Michel, 2014, P 4 INT WORKSH AUD V, P3, DOI DOI 10.1145/2661806.2661807; Vemulapalli R, 2016, PROC CVPR IEEE, P4471, DOI 10.1109/CVPR.2016.484; Vemulapalli R, 2014, PROC CVPR IEEE, P588, DOI 10.1109/CVPR.2014.82; Williamson JR, 2014, P 4 INT WORKSHOP AUD, P65; Zivkovic Z, 2004, INT C PATT RECOG, P28, DOI 10.1109/ICPR.2004.1333992	31	18	19	4	5	IEEE	NEW YORK	345 E 47TH ST, NEW YORK, NY 10017 USA	2326-5396		978-1-5386-2335-0	IEEE INT CONF AUTOMA			2018							739	745		10.1109/FG.2018.00116	http://dx.doi.org/10.1109/FG.2018.00116			7	Computer Science, Artificial Intelligence; Engineering, Electrical & Electronic	Conference Proceedings Citation Index - Science (CPCI-S)	Computer Science; Engineering	BL7GJ	30271308	Green Accepted, Green Submitted			2022-10-03	WOS:000454996700106
J	Szirtes, G; Orozco, J; Istvan, P; Daniel, S; Akos, U; Cohn, JF				Szirtes, Gabor; Orozco, Javier; Istvan, Petras; Daniel, Szolgay; Akos, Utasi; Cohn, Jeffrey			Behavioral cues help predict impact of advertising on future sales	IMAGE AND VISION COMPUTING			English	Article						Market research; Behavioral cue; Predictive modeling; Facial expression analysis		Advertising aims to influence consumer preferences, appraisals, action tendencies, and behavior in order to increase sales. These are all components of emotion. In the past, they have been measured through self report or panel discussions. While informative, these approaches are difficult to scale to large numbers of consumers, fail to capture moment-to-moment changes in appraisals that may be predictive of sales, and depend on verbal mediation. We used web-cam technology to sample non-verbal responses to television commercials from four product categories in six different countries. For each participant, head pose, head motion, and more frequent facial expressions like smiling, surprise and disgust were automatically measured at each video frame and aggregated across subjects. Dynamic features from the aggregated series were input to simple linear ensemble classifier with 10-fold cross-validation to predict product sales. Sales were predicted with ROC AUC = 0.75, 95% CI [0.727,0.773] and predictions for unseen categories were consistent for all, but one product groups (ROC AUC varies between 0.74 and 0.83, except for Confections with 0.61). Predictions for unseen countries showed similar pattern: ROC AUC varied between 0.71 and 0.89, with the exception of Russia with ROC AUC 0.53. In comparison with previous attempts, our approach yielded higher overall performance and greater generalization over not modeled factors like country or category. These findings support the feasibility, efficiency, and predictive validity of sales predictions from large-scale sampling of viewers' moment-to-moment responses to commercial media. (C) 2017 Elsevier B.V. All rights reserved.	[Szirtes, Gabor; Orozco, Javier; Istvan, Petras; Daniel, Szolgay; Akos, Utasi] Realeyes OU, Tolgyfa Utca 24, H-1027 Budapest, Hungary; [Cohn, Jeffrey] Univ Pittsburgh, 4322 Sennott Sq, Pittsburgh, PA 15260 USA		Szirtes, G (corresponding author), Realeyes OU, Tolgyfa Utca 24, H-1027 Budapest, Hungary.	gabor.szirtes@realeyesit.com			European Community [645094]	European Community(European Commission)	This work was financially supported by the European Community Horizon 2020 [H2020/2014-2020] under grant agreement no. 645094 (SEWA Automatic Sentiment Analysis in the Wild). The authors would like to thank the Ehrenberg-Bass Institute for Marketing Science for helping in defining the data collection experiment, and MARS, Incorporated for providing the valuable sales lift data that made this research possible. The authors are especially grateful for the anonymous reviewers for their concerns and comments on transparency and simplicity.	Airola A, 2010, JMLR WORKSH CONF PRO, V8, P3; Ambadar Z, 2009, J NONVERBAL BEHAV, V33, P17, DOI 10.1007/s10919-008-0059-5; Calvo MG, 2014, J NONVERBAL BEHAV, V38, P549, DOI 10.1007/s10919-014-0191-3; CORTES C, 1995, MACH LEARN, V20, P273, DOI 10.1007/BF00994018; Damasio A. R., 1995, DESCARTES ERROR EMOT; Dibeklioglu H, 2015, ICMI'15: PROCEEDINGS OF THE 2015 ACM INTERNATIONAL CONFERENCE ON MULTIMODAL INTERACTION, P307, DOI 10.1145/2818346.2820776; Dolnicar S, 2011, INT J MARKET RES, V53, P231, DOI 10.2501/IJMR-53-2-231-252; Doshi A, 2012, J VISION, V12, DOI [10.1167/12.2.9, 10.1167/12.6.9]; Fawcett T, 2006, PATTERN RECOGN LETT, V27, P861, DOI 10.1016/j.patrec.2005.10.010; Glauner P., 2015, THESIS; Good PI, 2012, COMMON ERRORS STAT A, V4th; Green D.M., 1966, SIGNAL DETECTION THE; Hammal Z, 2015, INT CONF AFFECT, P281, DOI 10.1109/ACII.2015.7344584; Jeni LA, 2013, INT CONF AFFECT, P245, DOI 10.1109/ACII.2013.47; KELTNER D, 1995, J PERS SOC PSYCHOL, V68, P441, DOI 10.1037/0022-3514.68.3.441; LAFRANCE M, 1999, SOCIAL CONTEXT NONVE, P45; Liaukonyte J, 2015, MARKET SCI, V34, P311, DOI 10.1287/mksc.2014.0899; McDuff Daniel, 2015, IEEE Transactions on Affective Computing, V6, P223, DOI 10.1109/TAFFC.2014.2384198; McDuff D., 2013, P ESOMAR C; McDuff D. I., 2014, THESIS; Opitz D., 1999, J ARTIF INTELL RES, V11, P169; Orozco J, 2015, IMAGE VISION COMPUT, V42, P47, DOI 10.1016/j.imavis.2015.07.002; Rokach L, 2010, ARTIF INTELL REV, V33, P1, DOI 10.1007/s10462-009-9124-7; Rottenberg J., 2007, EMOTION ELICITATION; Scherer K.R., 2004, FEELINGS EMOTIONS AM, DOI DOI 10.1017/CBO9780511806582.009; Slaney M., 2014, P 16 INT C MULT INT, P144; statista. com, 2015, US ADV IND STAT FACT; Vapnik V., 1999, NATURE STAT LEARNING; Vriens M, 2001, MARK RES, V13, P14; Xiong Xuehan, 2013, P IEEE C COMP VIS PA; ZAJONC RB, 1980, AM PSYCHOL, V35, P151, DOI 10.1037/0003-066X.35.2.151	31	1	1	0	8	ELSEVIER	AMSTERDAM	RADARWEG 29, 1043 NX AMSTERDAM, NETHERLANDS	0262-8856	1872-8138		IMAGE VISION COMPUT	Image Vis. Comput.	SEP	2017	65				SI		49	57		10.1016/j.imavis.2017.03.002	http://dx.doi.org/10.1016/j.imavis.2017.03.002			9	Computer Science, Artificial Intelligence; Computer Science, Software Engineering; Computer Science, Theory & Methods; Engineering, Electrical & Electronic; Optics	Science Citation Index Expanded (SCI-EXPANDED); Social Science Citation Index (SSCI)	Computer Science; Engineering; Optics	FJ3GM					2022-10-03	WOS:000412618500006
J	Chu, WS; De la Torre, F; Cohn, JF; Messinger, DS				Chu, Wen-Sheng; De la Torre, Fernando; Cohn, Jeffrey; Messinger, Daniel S.			A Branch-and-Bound Framework for Unsupervised Common Event Discovery	INTERNATIONAL JOURNAL OF COMPUTER VISION			English	Article						Common event discovery; Synchrony discovery; Video indexing; Event detection; Human interaction; Unsupervised learning; Global optimization; Branch and bound; Bag-of-words	FACIAL EXPRESSION; DYNAMICS; IMAGE	Event discovery aims to discover a temporal segment of interest, such as human behavior, actions or activities. Most approaches to event discovery within or between time series use supervised learning. This becomes problematic when relevant event labels are unknown, are difficult to detect, or not all possible combinations of events have been anticipated. To overcome these problems, this paper explores Common Event Discovery (CED), a new problem that aims to discover common events of variable-length segments in an unsupervised manner. A potential solution to CED is searching over all possible pairs of segments, which would incur a prohibitive quartic cost. In this paper, we propose an efficient branch-and-bound (B&B) framework that avoids exhaustive search while guaranteeing a globally optimal solution. To this end, we derive novel bounding functions for various commonality measures and provide extensions to multiple commonality discovery and accelerated search. The B&B framework takes as input any multidimensional signal that can be quantified into histograms. A generalization of the framework can be readily applied to discover events at the same or different times (synchrony and event commonality, respectively). We consider extensions to video search and supervised event detection. The effectiveness of the B&B framework is evaluated in motion capture of deliberate behavior and in video of spontaneous facial behavior in diverse interpersonal contexts: interviews, small groups of young adults, and parent-infant face-to-face interaction.	[Chu, Wen-Sheng; De la Torre, Fernando; Cohn, Jeffrey] Carnegie Mellon Univ, Inst Robot, Pittsburgh, PA 15213 USA; [Cohn, Jeffrey] Univ Pittsburgh, Dept Psychol, Pittsburgh, PA 15260 USA; [Messinger, Daniel S.] Univ Miami, Dept Psychol, POB 248185, Coral Gables, FL 33124 USA		Chu, WS (corresponding author), Carnegie Mellon Univ, Inst Robot, Pittsburgh, PA 15213 USA.	wschu@cmu.edu; ftorre@cs.cmu.edu; jeffcohn@pitt.edu; dmessinger@miami.edu	Chu, Wen-Sheng/AAF-6871-2019	Chu, Wen-Sheng/0000-0001-8592-6088	US National Institutes of Health [GM105004, MH096951]; NATIONAL INSTITUTE OF GENERAL MEDICAL SCIENCES [R01GM105004] Funding Source: NIH RePORTER; NATIONAL INSTITUTE OF MENTAL HEALTH [R01MH096951] Funding Source: NIH RePORTER	US National Institutes of Health(United States Department of Health & Human ServicesNational Institutes of Health (NIH) - USA); NATIONAL INSTITUTE OF GENERAL MEDICAL SCIENCES(United States Department of Health & Human ServicesNational Institutes of Health (NIH) - USANIH National Institute of General Medical Sciences (NIGMS)); NATIONAL INSTITUTE OF MENTAL HEALTH(United States Department of Health & Human ServicesNational Institutes of Health (NIH) - USANIH National Institute of Mental Health (NIMH))	This work was supported in part by US National Institutes of Health grants GM105004 and MH096951. Any opinions, findings, and conclusions or recommendations expressed in this material are those of the authors and do not necessarily reflect the views of the National Institutes of Health. The authors would like to thank Feng Zhou and Jiabei Zeng for helping partial experiments.	Amberg B., 2011, ICCV; Chaaraoui AA, 2012, EXPERT SYST APPL, V39, P10873, DOI 10.1016/j.eswa.2012.03.005; [Anonymous], 2003, P ICCV; Balakrishnan V., 1991, International Journal of Robust and Nonlinear Control, V1, P295, DOI 10.1002/rnc.4590010404; Barbic J, 2004, PROC GRAPH INTERF, P185; Bartlett M. S., 2006, Journal of Multimedia, V1, DOI 10.4304/jmm.1.6.22-35; Begum N, 2014, PROC VLDB ENDOW, V8, P149, DOI 10.14778/2735471.2735476; Boiman O., 2005, ICCV; Brand M, 1997, CVPR; Brendel W, 2011, IEEE I CONF COMP VIS, P778, DOI 10.1109/ICCV.2011.6126316; Chu W.-S., 2012, ECCV; Chu W. S., 2015, ICCV; Chu W. S., 2010, P ACCV; Chu W. S., 2016, TPAMI; Cooper IL, 2009, CVPR; De la Torre F., 2015, AUTOMATIC FACE GESTU; Delaherche E, 2012, IEEE T AFFECT COMPUT, V3, P349, DOI 10.1109/T-AFFC.2012.12; Ding X., 2012, ICCV; Du SC, 2014, P NATL ACAD SCI USA, V111, pE1454, DOI 10.1073/pnas.1322355111; Duchenne O., 2009, ICCV; Everingham M., 2006, 2 PASCAL CHALLENGE; Feris R., 2014, ICMR; Gao L, 2015, CVPR; GENDRON B, 1994, OPER RES, V42, P1042, DOI 10.1287/opre.42.6.1042; Girard J. M., 2015, AFGR; Goldberger J., 2003, ICCV; Gusfield D, 1997, ALGORITHMS STRINGS T; Han D., 2009, ICCV; Hoai M., 2011, CVPR; Hongeng S., 2001, ICCV; Hu WM, 2011, IEEE T SYST MAN CY C, V41, P797, DOI 10.1109/TSMCC.2011.2109710; Jhuang H., 2007, ICCV; Keogh E, 2005, KNOWL INF SYST, V7, P358, DOI 10.1007/s10115-004-0154-9; Kruger S. E., 2005, INTERSPEECH; Kuipers B., 2011, CVPR; Lampert CH, 2009, IEEE T PATTERN ANAL, V31, P2129, DOI 10.1109/TPAMI.2009.144; Laptev I., 2008, P CVPR; Lehmann A, 2011, INT J COMPUT VISION, V94, P175, DOI 10.1007/s11263-010-0342-x; Littlewort G, 2006, IMAGE VISION COMPUT, V24, P615, DOI 10.1016/j.imavis.2005.09.011; Liu CD, 2010, IEEE T INF TECHNOL B, V14, P1236, DOI 10.1109/TITB.2010.2052061; Liu H.R., 2010, P CVPR; Lucey Patrick, 2010, CVPRW; MAIER D, 1978, J ACM, V25, P322, DOI 10.1145/322063.322075; Matthews I, 2004, INT J COMPUT VISION, V60, P135, DOI 10.1023/B:VISI.0000029666.37597.d3; Messinger DM, 2010, NEURAL NETWORKS, V23, P1004, DOI 10.1016/j.neunet.2010.08.008; Messinger DS, 2009, INFANCY, V14, P285, DOI 10.1080/15250000902839963; Minnen D., 2007, KDD; Mukherjee L., 2011, P CVPR; NARENDRA P, 1977, IEEE T COMPUT, V26, P917, DOI 10.1109/tc.1977.1674939; Nayak S, 2012, J MACH LEARN RES, V13, P2589; Oliver NM, 2000, IEEE T PATTERN ANAL, V22, P831, DOI 10.1109/34.868684; Paterson M., 1994, Mathematical Foundations of Computer Science 1994. 19th International Symposium, MFCS'94. Proceedings, P127; Platt JC, 2000, ADV NEUR IN, P61; Reddy KK, 2013, MACH VISION APPL, V24, P971, DOI 10.1007/s00138-012-0450-4; Rubner Y, 2000, INT J COMPUT VISION, V40, P99, DOI 10.1023/A:1026543900054; Sadanand S., 2012, P 2012 IEEE C COMP V; Sangineto E., 2014, P ACMMM; Sayette MA, 2012, PSYCHOL SCI, V23, P869, DOI 10.1177/0956797611435134; Schindler G., 2008, P CVPR; Schmidt RC, 2012, J NONVERBAL BEHAV, V36, P263, DOI 10.1007/s10919-012-0138-5; SCHOLKOPF B, 2001, NIPS; Schuller B., 2006, INTERSPEECH; Si Z., 2011, ICCV; Sun M., 2012, CVPR; Turaga P, 2009, COMPUT VIS IMAGE UND, V113, P353, DOI 10.1016/j.cviu.2008.08.009; Valstar Michel, 2006, CVPRW; Viola P, 2004, INT J COMPUT VISION, V57, P137, DOI 10.1023/B:VISI.0000013087.49260.fb; Wang HX, 2014, WIRES DATA MIN KNOWL, V4, P24, DOI 10.1002/widm.1110; Wang Y., 2009, ICASSP; Wang Y., 2006, P CVPR; YANG Y, 2013, PAMI, V35, P1635, DOI DOI 10.1109/TPAMI.2012.253; Yang Y, 2013, IEEE T MULTIMEDIA, V15, P572, DOI 10.1109/TMM.2012.2234731; Yu X., 2013, AUTOMATIC FACE GESTU; Yuan JS, 2009, PROC CVPR IEEE, P2442, DOI [10.1109/CVPRW.2009.5206671, 10.1109/CVPR.2009.5206671]; Zheng Y., 2011, ACMMM; Zhou F., 2010, P CVPR; Zhou F, 2013, IEEE T PATTERN ANAL, V35, P582, DOI 10.1109/TPAMI.2012.137; Zhu SC, 2006, FOUND TRENDS COMPUT, V2, P259, DOI 10.1561/0600000018	79	5	5	0	2	SPRINGER	DORDRECHT	VAN GODEWIJCKSTRAAT 30, 3311 GZ DORDRECHT, NETHERLANDS	0920-5691	1573-1405		INT J COMPUT VISION	Int. J. Comput. Vis.	JUL	2017	123	3					372	391		10.1007/s11263-017-0989-7	http://dx.doi.org/10.1007/s11263-017-0989-7			20	Computer Science, Artificial Intelligence	Science Citation Index Expanded (SCI-EXPANDED)	Computer Science	EX9EO	28943718	Green Accepted			2022-10-03	WOS:000403559600004
