PT	AU	BA	BE	GP	AF	BF	CA	TI	SO	SE	BS	LA	DT	CT	CY	CL	SP	HO	DE	ID	AB	C1	C3	RP	EM	RI	OI	FU	FP	FX	CR	NR	TC	Z9	U1	U2	PU	PI	PA	SN	EI	BN	J9	JI	PD	PY	VL	IS	PN	SU	SI	MA	BP	EP	AR	DI	DL	D2	EA	PG	WC	WE	SC	GA	PM	OA	HC	HP	DA	UT
C	Pillai, RK; Jeni, LA; Yang, HY; Zhang, Z; Yin, LJ; Cohn, JF			IEEE	Pillai, Rohith Krishnan; Jeni, Laszlo A.; Yang, Huiyuan; Zhang, Zheng; Yin, Lijun; Cohn, Jeffrey			The 2nd 3D Face Alignment in the Wild Challenge (3DFAW-Video): Dense Reconstruction From Video	2019 IEEE/CVF INTERNATIONAL CONFERENCE ON COMPUTER VISION WORKSHOPS (ICCVW)	IEEE International Conference on Computer Vision Workshops		English	Proceedings Paper	IEEE/CVF International Conference on Computer Vision (ICCV)	OCT 27-NOV 02, 2019	Seoul, SOUTH KOREA	IEEE, IEEE Comp Soc, CVF				3D face alignment approaches have strong advantages over 2D with respect to representational power and robustness to illumination and pose. Over the past few years a number of research groups have made rapid advances in dense 3D alignment from 2D video and obtained impressive results. How these various methods compare is relatively unknown. Previous benchmarks addressed sparse 3D alignment and single image 3D reconstruction. No commonly accepted evaluation protocol exists for dense 3D face reconstruction from video with which to compare them. The 2nd 3D Face Alignment in the Wild from Videos (3DFAW-Video) Challenge extends the previous 3DFAW 2016 competition to the estimation of dense 3D facial structure from video. It presented a new large corpora of profile-to-profile face videos recorded under different imaging conditions and annotated with corresponding high-resolution 3D ground truth meshes. In this paper we outline the evaluation protocol, the data used, and the results. 3DFAW-Video is to be held in conjunction with the 2019 International Conference on Computer Vision, in Seoul, Korea.	[Pillai, Rohith Krishnan; Jeni, Laszlo A.] Carnegie Mellon Univ, Inst Robot, Pittsburgh, PA 15213 USA; [Yang, Huiyuan; Zhang, Zheng; Yin, Lijun] SUNY Binghamton, Dept Comp Sci, Binghamton, NY 13902 USA; [Cohn, Jeffrey] Univ Pittsburgh, Dept Psychol, Pittsburgh, PA 15260 USA		Pillai, RK (corresponding author), Carnegie Mellon Univ, Inst Robot, Pittsburgh, PA 15213 USA.	rohithkp@cmu.edu; laszlojeni@cmu.edu; hyang51@binghamton.edu; zzhang@binghamton.edu; lijun@cs.binghamton.edu; jeffcohn@pitt.edu	Yang, Huiyuan/AAX-5521-2021	Yang, Huiyuan/0000-0003-0517-5187	US Department of Defense [W911SR-17-C0060]; NSF [CNS-1629716, CNS-1629898]	US Department of Defense(United States Department of Defense); NSF(National Science Foundation (NSF))	This work was supported in part by US Department of Defense grant W911SR-17-C0060, and NSF grants CNS-1629716 and CNS-1629898. We also thank Yu Deng and Jiaolong Yang from Microsoft Research Asia for providing the evaluation code and protocol for use in the challenge.	Bagdanov A. D., 2011, P 2011 JOINT ACM WOR, P7980; Cao C., 2013, IEEE T VISUALIZATION, V20, P413; Chrysos GG, 2017, IEEE COMPUT SOC CONF, P2015, DOI 10.1109/CVPRW.2017.252; Cignoni Paolo, 2008, EUR IT CHAPT C, P129; Deng Y, 2019, EURASIP J IMAGE VIDE, DOI 10.1186/s13640-018-0400-9; Feng Y., 2018, P EUR C COMP VIS ECC, P534; Feng ZH, 2018, IEEE INT CONF AUTOMA, P780, DOI 10.1109/FG.2018.00123; Gecer B, 2019, PROC CVPR IEEE, P1155, DOI 10.1109/CVPR.2019.00125; Gerig T, 2018, IEEE INT CONF AUTOMA, P75, DOI 10.1109/FG.2018.00021; Gross R, 2010, IMAGE VISION COMPUT, V28, P807, DOI 10.1016/j.imavis.2009.08.002; Jeni LA, 2016, LECT NOTES COMPUT SC, V9914, P511, DOI 10.1007/978-3-319-48881-3_35; Kazhdan M., 2013, ACM T GRAPHIC, V32, P29; King DE, 2009, J MACH LEARN RES, V10, P1755; Koppen P, 2018, PATTERN RECOGN, V74, P617, DOI 10.1016/j.patcog.2017.09.006; Li T, 2017, CHIN J CANCER, V36, DOI 10.1186/s40880-016-0172-5; Liu Z., 2018, LARGE SCALE CELEBFAC, V15, P2018; Tran L, 2018, PROC CVPR IEEE, P7346, DOI 10.1109/CVPR.2018.00767; Maldonado E. R., 2019, P IEEE INT C COMP VI; Mortazavian P., 2016, VISIGRAPP; Sagonas C, 2016, IMAGE VISION COMPUT, V47, P3, DOI 10.1016/j.imavis.2016.01.002; Sagonas C, 2013, 2013 IEEE INTERNATIONAL CONFERENCE ON COMPUTER VISION WORKSHOPS (ICCVW), P397, DOI 10.1109/ICCVW.2013.59; Sanyal S, 2019, PROC CVPR IEEE, P7755, DOI 10.1109/CVPR.2019.00795; Savran A, 2008, LECT NOTES COMPUT SC, V5372, P47, DOI 10.1007/978-3-540-89991-4_6; Shao X.-H., 2019, P IEEE INT C COMP VI; Tewari A, 2017, IEEE INT CONF COMP V, P1274, DOI 10.1109/ICCVW.2017.153; Tran A. Tuan, 2017, P IEEE C COMP VIS PA, P5163; Wu FZ, 2019, PROC CVPR IEEE, P959, DOI 10.1109/CVPR.2019.00105; Yi H., 2019, P IEEE C COMP VIS PA, P7663; Yin LJ, 2006, PROCEEDINGS OF THE SEVENTH INTERNATIONAL CONFERENCE ON AUTOMATIC FACE AND GESTURE RECOGNITION - PROCEEDINGS OF THE SEVENTH INTERNATIONAL CONFERENCE, P211; Zafeiriou S, 2017, IEEE INT CONF COMP V, P2503, DOI 10.1109/ICCVW.2017.16; Zhang X, 2014, IMAGE VISION COMPUT, V32, P692, DOI 10.1016/j.imavis.2014.06.002; Zhao DP, 2013, INT J ADV ROBOT SYST, V10, DOI 10.5772/56759; Zhu XY, 2016, PROC CVPR IEEE, P146, DOI 10.1109/CVPR.2016.23	33	1	1	0	0	IEEE COMPUTER SOC	LOS ALAMITOS	10662 LOS VAQUEROS CIRCLE, PO BOX 3014, LOS ALAMITOS, CA 90720-1264 USA	2473-9936		978-1-7281-5023-9	IEEE INT CONF COMP V			2019							3082	3089		10.1109/ICCVW.2019.00371	http://dx.doi.org/10.1109/ICCVW.2019.00371			8	Computer Science, Artificial Intelligence; Computer Science, Theory & Methods; Imaging Science & Photographic Technology	Conference Proceedings Citation Index - Science (CPCI-S)	Computer Science; Imaging Science & Photographic Technology	BP4UH					2022-10-03	WOS:000554591603021
C	Schulc, A; Cohn, JF; Shen, J; Pantic, M			IEEE	Schulc, Attila; Cohn, Jeffrey; Shen, Jie; Pantic, Maja			Automatic Measurement of Visual Attention to Video Content using Deep Learning	PROCEEDINGS OF MVA 2019 16TH INTERNATIONAL CONFERENCE ON MACHINE VISION APPLICATIONS (MVA)			English	Proceedings Paper	16th International Conference on Machine Vision Applications (MVA)	MAY 27-31, 2019	Tokyo, JAPAN	MVA Org, IEICE ISS TG Pattern Recognit & Media Understanding, Informat Proc Soc Japan SIG Comp Vis & Image Media, IEEE Robot & Automat Soc, Informat Proc Soc Japan, Inst Elect Engineers Japan, Inst Elect Informat & Commun Engineers, Inst Image Informat & Televis Engineers, Inst Syst Control & Informat Engineers, Inst Image Elect Engineers Japan, Japanese Soc Artificial Intelligence, Japanese Soc Non Destruct Inspect, Japan Soc Precis Engn, Robot Soc Japan, Soc Acad Study Sensing Image Informat, Soc Automot Engineers Japan, Soc Instrument & Control Engineers, Virtual Real Soc Japan				Advances in automated face analysis have made possible webcam-based assessment of viewer emotion during presentation of commercials and other video content. A key assumption of this technology is that viewer emotion is in response to the media. Is that assumption warranted? Because viewer attention is seldom assessed, emotional responses could result from other sources, such as talking to a friend, enjoying a meal, or attending to a pet. We developed a CNN-LSTM approach that detects attention and non-attention to commercials using webcam and mobile devices in settings of viewer's choice. Because cultural variation in viewer response is likely, we included participants from both Western and Eastern countries. Participants were 28,911 adults (ages 18 to 69 years) in Europe, USA, Russia, and China. A total of 15,543 sessions (ca. 6.5 million video frames) was analyzed. Accuracy was quantified using a variety of metrics. Our approach outperformed baseline and achieved moderate to high accuracy that approached that of human annotators.	[Schulc, Attila; Cohn, Jeffrey; Pantic, Maja] Realeyes, Budapest, Hungary; [Cohn, Jeffrey] Univ Pittsburgh, Dept Psychol, Pittsburgh, PA 15260 USA; [Shen, Jie; Pantic, Maja] Imperial Coll London, Dept Comp, London, England; [Shen, Jie; Pantic, Maja] Samsung AI Ctr, Cambridge, England		Schulc, A (corresponding author), Realeyes, Budapest, Hungary.	attila.schulc@realeyesit.com; jeffcohn@pitt.edu; jie.shen07@imperial.ac.uk; m.pantic@imperial.ac.uk						Asteriadis S., 2011, Proceedings of the 2011 3rd International Conference on Games and Virtual Worlds for Serious Applications (VS-GAMES 2011), P186, DOI 10.1109/VS-GAMES.2011.38; Ba S. O., 2006, Multimodal Technologies for Perception of Humans. First International Evaluation Workshop on Classification of Events, Activities and Relationships, CLEAR 2006. Revised Selected Papers (Lecture Notes in Computer Science Vol.4122), P345; Bennett FM, 1954, PUBLIC OPIN QUART, V18, P303; Bergasa LM, 2008, PROCEEDINGS OF THE 11TH INTERNATIONAL IEEE CONFERENCE ON INTELLIGENT TRANSPORTATION SYSTEMS, P1149, DOI 10.1109/ITSC.2008.4732544; BRENNAN RL, 1981, EDUC PSYCHOL MEAS, V41, P687, DOI 10.1177/001316448104100307; Campbell K, 2018, AUTISM; Chang C, 2018, ICMI'18: PROCEEDINGS OF THE 20TH ACM INTERNATIONAL CONFERENCE ON MULTIMODAL INTERACTION, P616, DOI 10.1145/3242969.3264986; Dhall A, 2018, ICMI'18: PROCEEDINGS OF THE 20TH ACM INTERNATIONAL CONFERENCE ON MULTIMODAL INTERACTION, P653; Fridman L, 2016, IET COMPUT VIS, V10, P308, DOI 10.1049/iet-cvi.2015.0296; Gupta A., 2016, CORR; Hassner Tal, 2015, IEEE C COMP VIS PATT; Hernandez J, 2013, 2013 10TH INTERNATIONAL CONFERENCE ON ELECTRICAL ENGINEERING, COMPUTING SCIENCE AND AUTOMATIC CONTROL (CCE), P13, DOI 10.1109/ICEEE.2013.6676009; Jeni LA, 2017, IMAGE VISION COMPUT, V58, P13, DOI 10.1016/j.imavis.2016.05.009; Jeni LA, 2013, INT CONF AFFECT, P245, DOI 10.1109/ACII.2013.47; KING WM, 1976, J NEUROPHYSIOL, V39, P1135, DOI 10.1152/jn.1976.39.6.1135; Klier EM, 2003, J NEUROPHYSIOL, V89, P2839, DOI 10.1152/jn.00763.2002; Ko BC, 2018, SENSORS; Li H, 2015, HCOMP; Li Y, 2017, WWW; Lyu J, 2018, CORR; Masse  Benoit, 2017, IEEE T PATTERN ANAL; McDuff D, 2013, P ESOMAR C, V1, P2; Mustafa A, 2018, CORR; Ngxande M, 2017, 2017 PATTERN RECOGNITION ASSOCIATION OF SOUTH AFRICA AND ROBOTICS AND MECHATRONICS (PRASA-ROBMECH), P156, DOI 10.1109/RoboMech.2017.8261140; Palinko O, 2016, 2016 IEEE/RSJ INTERNATIONAL CONFERENCE ON INTELLIGENT ROBOTS AND SYSTEMS (IROS 2016), P5048, DOI 10.1109/IROS.2016.7759741; Robal T, 2018, IUI 2018: PROCEEDINGS OF THE 23RD INTERNATIONAL CONFERENCE ON INTELLIGENT USER INTERFACES, P189, DOI 10.1145/3172944.3172987; Rosenthal R, 2005, NEW HDB METHODS NONV, P199; Sheikhi Samira, 2012, Human Behavior Understanding. Proceedings of the Third International Workshop, HBU 2012, P99, DOI 10.1007/978-3-642-34014-7_9; Szirtes G, 2017, IMAGE VISION COMPUT, V65, P49, DOI 10.1016/j.imavis.2017.03.002; Waibel A., 1999, INT C ADV VIS INF SY, P765; Xiong XH, 2013, PROC CVPR IEEE, P532, DOI 10.1109/CVPR.2013.75	31	0	0	0	2	IEEE	NEW YORK	345 E 47TH ST, NEW YORK, NY 10017 USA			978-4-901122-18-4				2019														6	Computer Science, Artificial Intelligence; Computer Science, Theory & Methods; Engineering, Electrical & Electronic	Conference Proceedings Citation Index - Science (CPCI-S)	Computer Science; Engineering	BN5QA					2022-10-03	WOS:000484550200062
C	Yang, L; Ertugrul, IO; Cohn, JF; Hammal, Z; Jiang, DM; Sahli, H			IEEE	Yang, Le; Ertugrul, Itir Onal; Cohn, Jeffrey; Hammal, Zakia; Jiang, Dongmei; Sahli, Hichem			FACS3D-Net: 3D Convolution based Spatiotemporal Representation for Action Unit Detection	2019 8TH INTERNATIONAL CONFERENCE ON AFFECTIVE COMPUTING AND INTELLIGENT INTERACTION (ACII)	International Conference on Affective Computing and Intelligent Interaction		English	Proceedings Paper	8th International Conference on Affective Computing and Intelligent Interaction (ACII)	SEP 03-06, 2019	Cambridge, ENGLAND			CNN; CNN-LSTM; FACS3D-Net; spatiotemporal information; multi-label AU detection		Most approaches to automatic facial action unit (AU) detection consider only spatial information and ignore AU dynamics. For humans, dynamics improves AU perception. Is same true for algorithms? To make use of AU dynamics, recent work in automated AU detection has proposed a sequential spatiotemporal approach: Model spatial information using a 2D CNN and then model temporal information using LSTM (Long-Short-Term Memory). Inspired by the experience of human FACS coders, we hypothesized that combining spatial and temporal information simultaneously would yield more powerful AU detection. To achieve this, we propose FACS3D-Net that simultaneously integrates 3D and 2D CNN. Evaluation was on the Expanded BP4D+ database of 200 participants. FACS3D-Net outperformed both 2D CNN and 2D CNN-LSTM approaches. Visualizations of learnt representations suggest that FACS3D-Net is consistent with the spatiotemporal dynamics attended to by human FACS coders. To the best of our knowledge, this is the first work to apply 3D CNN to the problem of AU detection.	[Yang, Le; Jiang, Dongmei] Northwestern Polytech Univ, Sch Comp Sci, Xian, Peoples R China; [Ertugrul, Itir Onal; Hammal, Zakia] Carnegie Mellon Univ, Inst Robot, Pittsburgh, PA 15213 USA; [Cohn, Jeffrey] Univ Pittsburgh, Dept Psychol, Pittsburgh, PA 15260 USA; [Jiang, Dongmei] Peng Cheng Lab, Shenzhen, Guangdong, Peoples R China; [Sahli, Hichem] Vrije Univ Brussel, Dept Elect & Informat, Brussels, Belgium; [Sahli, Hichem] Interuniv Microelect Ctr, Heverlee, Belgium		Yang, L (corresponding author), Northwestern Polytech Univ, Sch Comp Sci, Xian, Peoples R China.	yangle.cst@gmail.com			NIH [NS100549, MH096951]; NSF [CNS-1629716]; Shaanxi Provincial International Science and Technology Collaboration Project [2017KW-ZD-14]; VUB Interdisciplinary Research Program through the EMO-App project	NIH(United States Department of Health & Human ServicesNational Institutes of Health (NIH) - USA); NSF(National Science Foundation (NSF)); Shaanxi Provincial International Science and Technology Collaboration Project; VUB Interdisciplinary Research Program through the EMO-App project	This research was supported in part by NIH awards NS100549 and MH096951, NSF award CNS-1629716, the Shaanxi Provincial International Science and Technology Collaboration Project (grant 2017KW-ZD-14), and the VUB Interdisciplinary Research Program through the EMO-App project.	Ambadar Z, 2005, PSYCHOL SCI, V16, P403, DOI 10.1111/j.0956-7976.2005.01548.x; Byeon YH, 2014, INT J ADV COMPUT SC, V5, P107, DOI 10.14569/ijacsa.2014.051215; Carreira J., 2017, P IEEE C COMP VIS PA, P6299; Chu WS, 2019, IMAGE VISION COMPUT, V81, P1, DOI 10.1016/j.imavis.2018.10.002; Chu WS, 2013, PROC CVPR IEEE, P3515, DOI 10.1109/CVPR.2013.451; Tran D, 2015, IEEE I CONF COMP VIS, P4489, DOI 10.1109/ICCV.2015.510; Ertugrul Itir Onal, 2019, 2019 14th IEEE International Conference on Automatic Face & Gesture Recognition (FG 2019), DOI 10.1109/FG.2019.8756623; Ertugrul I. Onal, 2019, 2019 14 IEEE INT C A; Ertugrul IO, 2018, IEEE COMPUT SOC CONF, P2211, DOI 10.1109/CVPRW.2018.00287; Fan Y, 2016, ICMI'16: PROCEEDINGS OF THE 18TH ACM INTERNATIONAL CONFERENCE ON MULTIMODAL INTERACTION, P445, DOI 10.1145/2993148.2997632; Friesen E., 1978, PALO ALTO, V3; Girard JM, 2017, IEEE INT CONF AUTOMA, P581, DOI 10.1109/FG.2017.144; Gonzalez I, 2015, MULTIMED TOOLS APPL, V74, P10001, DOI 10.1007/s11042-014-2320-8; He J, 2017, IEEE INT CONF AUTOMA, P848, DOI 10.1109/FG.2017.108; Jaiswal Shashank, 2016, WACV; Jeni LA, 2017, IMAGE VISION COMPUT, V58, P13, DOI 10.1016/j.imavis.2016.05.009; Jeni LA, 2013, INT CONF AFFECT, P245, DOI 10.1109/ACII.2013.47; Ji SW, 2013, IEEE T PATTERN ANAL, V35, P221, DOI 10.1109/TPAMI.2012.59; Jing LL, 2018, J VIS COMMUN IMAGE R, V52, P58, DOI 10.1016/j.jvcir.2018.01.016; Li W, 2017, COMPUT INTEL NEUROSC, V2017, DOI 10.1155/2017/9471841; Li W, 2017, IEEE INT CONF AUTOMA, P103, DOI 10.1109/FG.2017.136; Shao Z., 2018, P EUR C COMP VIS ECC, P705; Valstar MF, 2007, LECT NOTES COMPUT SC, V4796, P118; Zeiler MD, 2014, LECT NOTES COMPUT SC, V8689, P818, DOI 10.1007/978-3-319-10590-1_53; Zhang Z, 2016, PROC CVPR IEEE, P3438, DOI 10.1109/CVPR.2016.374; Zhao KL, 2016, PROC CVPR IEEE, P3391, DOI 10.1109/CVPR.2016.369	26	2	2	0	2	IEEE	NEW YORK	345 E 47TH ST, NEW YORK, NY 10017 USA	2156-8103		978-1-7281-3888-6	INT CONF AFFECT			2019														7	Computer Science, Artificial Intelligence; Computer Science, Information Systems; Engineering, Electrical & Electronic	Conference Proceedings Citation Index - Science (CPCI-S)	Computer Science; Engineering	BO6TZ					2022-10-03	WOS:000522220800093
J	Cohn, JF				Cohn, Jeffrey			Advanced serious illness, multimorbidity, and multibeneficence: The role of communication	JOURNAL OF EVALUATION IN CLINICAL PRACTICE			English	Article								Sturmberg et al write about multimorbidity as "several diagnosable diseases within the same individual." They posit that this syndrome is the result of multiple interconnected disturbances reflecting scale-free, fractal signs of pathology ranging from biochemical/hormonal alterations at one end of a spectrum to community and societal ills at the other. In this commentary, I will be focusing on 3 perspectives: 1) a preterminal phase of multimorbidity that is indicative of that loss of reparative or even homeokinetic properties, known by some as "advanced serious illness"; 2) the manifestations of advanced serious illness multimorbidity that, using the same networks that connect into the patient, are signs of this syndrome at the levels of the immediate family/friend social network, the broader community, and society at large; and 3) the potential for these same networks that transmit pathological forces to convey the positive effects of therapeutic interventions in a scale-free manner, with a focus on how conversation can lead to what I'm calling "multibeneficence."	[Cohn, Jeffrey] 1227 N 4th St, Philadelphia, PA 19122 USA		Cohn, JF (corresponding author), 1227 N 4th St, Philadelphia, PA 19122 USA.	jeff@commonpractice.com						Allen JY, 2013, J PALLIAT MED, V16, P745, DOI 10.1089/jpm.2012.0450; Cerulo M., 2015, TOPOLOGIK, V17, P79; Christakis NA, 2003, SOC SCI MED, V57, P465, DOI 10.1016/S0277-9536(02)00370-2; Coalition to Transform Advanced Care, WHAT WE MEAN WE SAY; Dy Sydney M, 2012, Evid Rep Technol Assess (Full Rep), P1; Hawthorn M., 2015, WORKING RELATIONAL D; Hawthorn Maureen, 2015, Br J Nurs, V24, P702, DOI 10.12968/bjon.2015.24.13.702; IOM, 2015, WORK REL DEPTH COUNS, P138; Mearns D., 2015, WORKING RELATIONAL D; Pauley PM, 2015, HEALTH COMMUN, V30, P646, DOI 10.1080/10410236.2014.888385; Sturmberg JP, 2017, J EVAL CLIN PRACT, V23, P199, DOI 10.1111/jep.12587; Vig EK, 2007, J GEN INTERN MED, V22, P1274, DOI 10.1007/s11606-007-0252-y	12	3	3	0	2	WILEY	HOBOKEN	111 RIVER ST, HOBOKEN 07030-5774, NJ USA	1356-1294	1365-2753		J EVAL CLIN PRACT	J. Eval. Clin. Pract.	DEC	2018	24	6			SI		1279	1281		10.1111/jep.12706	http://dx.doi.org/10.1111/jep.12706			3	Health Care Sciences & Services; Medical Informatics; Medicine, General & Internal	Science Citation Index Expanded (SCI-EXPANDED)	Health Care Sciences & Services; Medical Informatics; General & Internal Medicine	HA1SL	28205360				2022-10-03	WOS:000450002400001
J	Escalera, S; Baro, X; Guyon, I; Escalante, HJ; Tzimiropoulos, G; Valstar, M; Pantic, M; Cohn, JF; Kanade, T				Escalera Guerrero, Sergio; Baro, Xavier; Guyon, Isabelle; Escalante, Hugo Jair; Tzimiropoulos, Georgios; Valstar, Michel F.; Pantic, Maja; Cohn, Jeffrey; Kanade, Takeo			Guest Editorial: The Computational Face	IEEE TRANSACTIONS ON PATTERN ANALYSIS AND MACHINE INTELLIGENCE			English	Editorial Material									[Escalera Guerrero, Sergio] Univ Barcelona, Dept Math & Informat, E-08007 Barcelona, Spain; [Escalera Guerrero, Sergio] Comp Vis Ctr, Barcelona 08007, Spain; [Baro, Xavier] Univ Oberta Catalunya, Barcelona 08018, Spain; [Baro, Xavier] Univ Oberta Catalunya, Comp Sci Multimedia & Telecommun Dept, Barcelona 08018, Spain; [Baro, Xavier] Comp Vis Ctr, Barcelona 08018, Spain; [Guyon, Isabelle] Univ Paris Saclay, INRIA, UPSud, Big Data, F-91190 St Aubin, France; [Guyon, Isabelle] ChaLearn, Berkeley, CA 94708 USA; [Escalante, Hugo Jair] Inst Nacl Astrofis Opt & Eect, Puebla 72840, Mexico; [Tzimiropoulos, Georgios; Valstar, Michel F.] Univ Nottingham, Sch Comp Sci, Nottingham NG7 2RD, England; [Pantic, Maja] Imperial Coll, Affect & Behav Comp, London SW7 2AZ, England; [Cohn, Jeffrey] Univ Pittsburgh, Psychol & Psychiat, Pittsburgh, PA 15260 USA; [Kanade, Takeo] Carnegie Mellon Univ, Pittsburgh, PA 15213 USA		Escalera, S (corresponding author), Univ Barcelona, Dept Math & Informat, E-08007 Barcelona, Spain.; Escalera, S (corresponding author), Comp Vis Ctr, Barcelona 08007, Spain.	sergio@maia.ub.es; xbaro@uoc.edu; guyon@chalearn.org; hugojair@inaoep.mx; yorgos.tzimiropoulos@nottingham.ac.uk; michel.valstar@nottingham.ac.uk; m.pantic@imperial.ac.uk; jeffcohn@cs.cmu.edu; Takeo.Kanade@cs.cmu.edu	Baró, Xavier/A-4064-2011; Escalera Guerrero, Sergio/L-2998-2015	Baró, Xavier/0000-0001-5338-3007; Escalera Guerrero, Sergio/0000-0003-0617-8873; Tzimiropoulos, Georgios/0000-0002-1803-5338; Guyon, Isabelle/0000-0002-9266-1783; Valstar, Michel F./0000-0003-2414-161X	MINECO/FEDER, UE [TIN2015-66951-C2-2-R, TIN2016-74946-P]; CERCA Programme/Generalitat de Catalunya; INAOE, CONACyT-Mexico [241306]; ChaLearn Looking at People; Microsoft Research; Google; NVIDIA Coorporation; Amazon; Facebook; Disney Research	MINECO/FEDER, UE(Spanish Government); CERCA Programme/Generalitat de Catalunya; INAOE, CONACyT-Mexico; ChaLearn Looking at People; Microsoft Research(Microsoft); Google(Google Incorporated); NVIDIA Coorporation; Amazon; Facebook(Facebook Inc); Disney Research	This project has been partially supported by the Spanish projects TIN2015-66951-C2-2-R and TIN2016-74946-P (MINECO/FEDER, UE) and CERCA Programme/Generalitat de Catalunya and by INAOE, CONACyT-Mexico under grant 241306. We thank ChaLearn Looking at People sponsors for their support, including Microsoft Research, Google, NVIDIA Coorporation, Amazon, Facebook, and Disney Research.	Booth J, 2018, IEEE T PATTERN ANAL, V40, P2638, DOI 10.1109/TPAMI.2018.2832138; Chrysos G. G., 2018, IEEE T PATTERN ANAL; Escalera S, 2017, IEEE IJCNN, P1594, DOI 10.1109/IJCNN.2017.7966041; Escalera S, 2016, IEEE COMPUT SOC CONF, P706, DOI 10.1109/CVPRW.2016.93; Escalera S, 2015, 2015 IEEE INTERNATIONAL CONFERENCE ON COMPUTER VISION WORKSHOP (ICCVW), P243, DOI 10.1109/ICCVW.2015.40; Han H, 2018, IEEE T PATTERN ANAL, V40, P2597, DOI 10.1109/TPAMI.2017.2738004; Kononenko D, 2018, IEEE T PATTERN ANAL, V40, P2696, DOI 10.1109/TPAMI.2017.2737423; Li W., 2018, IEEE T PATTERN ANAL, DOI [10.11069/TPAMI.2018.2791608, DOI 10.11069/TPAMI.2018.2791608]; Liu H, 2018, IEEE T PATTERN ANAL, V40, P2546, DOI 10.1109/TPAMI.2017.2734779; Masse B., 2018, IEEE T PATTERN ANAL, DOI [10.1109/TPAMI.2017.2785819, DOI 10.1109/TPAMI.2017.2785819]; Robinson J. P., 2018, IEEE T PATTERN ANAL, DOI [10.1109/TPAMI.2018.2826849, DOI 10.1109/TPAMI.2018.2826849]; Sagonas C., 2018, IEEE T PATTERN ANAL, DOI [10.11069/TPAMI.2017.2784421, DOI 10.11069/TPAMI.2017.2784421]; Tan Z., 2018, IEEE T PATTERN ANAL, DOI [10.1109/TPAMI.2017.2738004, DOI 10.1109/TPAMI.2017.2738004]; Wang MJ, 2018, IEEE T PATTERN ANAL, V40, P2682, DOI 10.1109/TPAMI.2017.2783940; Wang W., 2018, IEEE T PATTERN ANAL, DOI [10.1106/TPAMI.2018.2810881, DOI 10.1106/TPAMI.2018.2810881]; Yu Y, 2018, IEEE T PATTERN ANAL, V40, P2653, DOI 10.1109/TPAMI.2018.2841403	16	2	2	1	8	IEEE COMPUTER SOC	LOS ALAMITOS	10662 LOS VAQUEROS CIRCLE, PO BOX 3014, LOS ALAMITOS, CA 90720-1314 USA	0162-8828	1939-3539		IEEE T PATTERN ANAL	IEEE Trans. Pattern Anal. Mach. Intell.	NOV	2018	40	11					2541	2545		10.1109/TPAMI.2018.2869610	http://dx.doi.org/10.1109/TPAMI.2018.2869610			5	Computer Science, Artificial Intelligence; Engineering, Electrical & Electronic	Science Citation Index Expanded (SCI-EXPANDED)	Computer Science; Engineering	GW2AF		Green Submitted, Bronze			2022-10-03	WOS:000446683700001
