PT	AU	BA	BE	GP	AF	BF	CA	TI	SO	SE	BS	LA	DT	CT	CY	CL	SP	HO	DE	ID	AB	C1	C3	RP	EM	RI	OI	FU	FP	FX	CR	NR	TC	Z9	U1	U2	PU	PI	PA	SN	EI	BN	J9	JI	PD	PY	VL	IS	PN	SU	SI	MA	BP	EP	AR	DI	DL	D2	EA	PG	WC	WE	SC	GA	PM	OA	HC	HP	DA	UT
C	Ding, YH; Ertugrul, IO; Darzi, A; Provenza, NR; Jeni, LA; Borton, D; Goodman, W; Cohn, JF			ACM	Ding, Yaohan; Ertugrul, Itir Onal; Darzi, Ali; Provenza, Nicole R.; Jeni, Laszlo A.; Borton, David A.; Goodman, Wayne K.; Cohn, Jeffrey			Automated Detection of Optimal DBS Device Settings	COMPANION PUBLICATON OF THE 2020 INTERNATIONAL CONFERENCE ON MULTIMODAL INTERACTION (ICMI '20 COMPANION)			English	Proceedings Paper	International Conference on Multimodal Interaction (ICMI)	OCT 25-29, 2020	ELECTR NETWORK	Assoc Comp Machinery, ACM SIGCHI		affective computing; clinical research; deep brain stimulation (DBS); ventral striatum; obsessive-compulsive disorder (OCD)		Continuous deep brain stimulation (DBS) of the ventral striatum (VS) is an effective treatment for severe, treatment-refractory obsessive-compulsive disorder (OCD). Optimal parameter settings are signaled by a mirth response of intense positive affect, which is subjectively identified by clinicians. Subjective judgments are idiosyncratic and difficult to standardize. To objectively measure mirth responses, we used Automatic Facial Affect Recognition (AFAR) in a series of longitudinal assessments of a patient treated with DBS. Pre- and post-adjustment DBS were compared using both statistical and machine learning approaches. Positive affect was significantly higher after DBS adjustment. Using XGBoost and SVM, the participant's pre- and post-adjustment responses were differentiated with accuracy values of 0.76 and 0.75, which suggest feasibility of objective measurement of mirth response.	[Ding, Yaohan; Darzi, Ali; Cohn, Jeffrey] Univ Pittsburgh, Pittsburgh, PA 15260 USA; [Ertugrul, Itir Onal] Tilburg Univ, Tilburg, Netherlands; [Provenza, Nicole R.; Borton, David A.] Brown Univ, Providence, RI 02912 USA; [Jeni, Laszlo A.] Carnegie Mellon Univ, Pittsburgh, PA 15213 USA; [Goodman, Wayne K.] Baylor Coll Med, Houston, TX 77030 USA		Cohn, JF (corresponding author), Univ Pittsburgh, Pittsburgh, PA 15260 USA.	yad30@pitt.edu; i.onal@tilburguniversity.edu; ald260@pitt.edu; nicole_provenza@brown.edu; laszlojeni@cmu.edu; david_borton@brown.edu; wayne.goodman@bcm.edu; jeffcohn@pitt.edu	Darzi, Ali/AAZ-9158-2021					Alonso P, 2015, PLOS ONE, V10, DOI 10.1371/journal.pone.0133591; Ambadar Z, 2009, J NONVERBAL BEHAV, V33, P17, DOI 10.1007/s10919-008-0059-5; Baker JK, 2010, INT J BEHAV DEV, V34, P88, DOI 10.1177/0165025409350365; Chen TQ, 2016, KDD'16: PROCEEDINGS OF THE 22ND ACM SIGKDD INTERNATIONAL CONFERENCE ON KNOWLEDGE DISCOVERY AND DATA MINING, P785, DOI 10.1145/2939672.2939785; Denys D, 2020, AM J PSYCHIAT, V177, P265, DOI 10.1176/appi.ajp.2019.19060656; Dibeklioglu H, 2018, IEEE J BIOMED HEALTH, V22, P525, DOI 10.1109/JBHI.2017.2676878; Ekman P, 2002, NETWORK RES INFORM; Ertugrul Itir Onal, 2019, Proc Int Conf Autom Face Gesture Recognit, V2019, DOI 10.1109/FG.2019.8756623; Garcia MR, 2013, PLOS ONE, V8, DOI 10.1371/journal.pone.0073456; Girard Jeffrey M., 2020, PSYARXIV, DOI [10.31234/osf.io/397af (2020, DOI 10.31234/OSF.IO/397AF(2020]; GOODMAN WK, 1989, ARCH GEN PSYCHIAT, V46, P1006; Hammal Z, 2014, IEEE T AFFECT COMPUT, V5, P155, DOI 10.1109/TAFFC.2014.2326408; Martin KB, 2018, MOL AUTISM, V9, DOI 10.1186/s13229-018-0198-4; PLOS ONE Staff, 2019, PLoS One, V14, pe0213756, DOI 10.1371/journal.pone.0213756; Suykens JAK, 1999, NEURAL PROCESS LETT, V9, P293, DOI 10.1023/A:1018628609742	15	2	2	0	0	ASSOC COMPUTING MACHINERY	NEW YORK	1601 Broadway, 10th Floor, NEW YORK, NY, UNITED STATES			978-1-4503-8002-7				2020							354	356		10.1145/3395035.3425354	http://dx.doi.org/10.1145/3395035.3425354			3	Computer Science, Cybernetics; Computer Science, Theory & Methods; Engineering, Electrical & Electronic	Conference Proceedings Citation Index - Science (CPCI-S)	Computer Science; Engineering	BS6LE		Green Accepted			2022-10-03	WOS:000749408300066
J	Ertugrul, IO; Yang, L; Jeni, LA; Cohn, JF				Ertugrul, Itir Onal; Yang, Le; Jeni, Laszlo A.; Cohn, Jeffrey			D-PAttNet: Dynamic Patch-Attentive Deep Network for Action Unit Detection	FRONTIERS IN COMPUTER SCIENCE			English	Article						action unit detection; 3D face registration; 3D-CNN; sigmoidal attention; patch-based	HUMAN NEURAL SYSTEM; FACIAL EXPRESSIONS; FACE; EMOTIONS; RECOGNITION; MACHINE	Facial action units (AUs) relate to specific local facial regions. Recent efforts in automated AU detection have focused on learning the facial patch representations to detect specific AUs. These efforts have encountered three hurdles. First, they implicitly assume that facial patches are robust to head rotation; yet non-frontal rotation is common. Second, mappings between AUs and patches are defined a priori, which ignores co-occurrences among AUs. And third, the dynamics of AUs are either ignored or modeled sequentially rather than simultaneously as in human perception. Inspired by recent advances in human perception, we propose a dynamic patch-attentive deep network, called D-PAttNet, for AU detection that (i) controls for 3D head and face rotation, (ii) learns mappings of patches to AUs, and (iii) models spatiotemporal dynamics. D-PAttNet approach significantly improves upon existing state of the art.	[Ertugrul, Itir Onal; Jeni, Laszlo A.] Carnegie Mellon Univ, Robot Inst, Pittsburgh, PA 15213 USA; [Yang, Le] Northwestern Polytech Univ, Sch Comp Sci, Xian, Peoples R China; [Cohn, Jeffrey] Univ Pittsburgh, Dept Psychol, Pittsburgh, PA 15260 USA		Ertugrul, IO (corresponding author), Carnegie Mellon Univ, Robot Inst, Pittsburgh, PA 15213 USA.	iertugru@andrew.cmu.edu			NIH [NS100549, MH096951]; NSF [CNS 1629716]	NIH(United States Department of Health & Human ServicesNational Institutes of Health (NIH) - USA); NSF(National Science Foundation (NSF))	This research was supported in part by NIH awards NS100549 and MH096951 and NSF award CNS 1629716.	Ambadar Z, 2005, PSYCHOL SCI, V16, P403, DOI 10.1111/j.0956-7976.2005.01548.x; Arcurio LR, 2012, NEUROPSYCHOLOGIA, V50, P2454, DOI 10.1016/j.neuropsychologia.2012.06.016; Baltrusaitis T, 2018, IEEE INT CONF AUTOMA, P59, DOI 10.1109/FG.2018.00019; Bihan Jiang, 2011, Proceedings 2011 IEEE International Conference on Automatic Face & Gesture Recognition (FG 2011), P314, DOI 10.1109/FG.2011.5771416; Bould E, 2008, COGNITION EMOTION, V22, P1569, DOI 10.1080/02699930801921156; Chu WS, 2017, IEEE INT CONF AUTOMA, P25, DOI 10.1109/FG.2017.13; Chu WS, 2013, PROC CVPR IEEE, P3515, DOI 10.1109/CVPR.2013.451; Cohn JF, 2018, ICMI'18: PROCEEDINGS OF THE 20TH ACM INTERNATIONAL CONFERENCE ON MULTIMODAL INTERACTION, P40, DOI 10.1145/3242969.3243023; Corneanu C, 2018, LECT NOTES COMPUT SC, V11216, P309, DOI 10.1007/978-3-030-01258-8_19; Du SC, 2014, P NATL ACAD SCI USA, V111, pE1454, DOI 10.1073/pnas.1322355111; Ekman P, 2002, RES NEXUS; Eleftheriadis S, 2015, IEEE I CONF COMP VIS, P3792, DOI 10.1109/ICCV.2015.432; Ertugrul Itir Onal, 2019, Proc Int Conf Autom Face Gesture Recognit, V2019, DOI 10.1109/FG.2019.8756543; Ertugrul IO, 2019, IEEE INT CONF AUTOMA, P744; Fairhall SL, 2007, CEREB CORTEX, V17, P2400, DOI 10.1093/cercor/bhl148; Fan Y, 2016, ICMI'16: PROCEEDINGS OF THE 18TH ACM INTERNATIONAL CONFERENCE ON MULTIMODAL INTERACTION, P445, DOI 10.1145/2993148.2997632; George N, 1999, NAT NEUROSCI, V2, P574, DOI 10.1038/9230; Gonzalez I, 2015, MULTIMED TOOLS APPL, V74, P10001, DOI 10.1007/s11042-014-2320-8; Grill-Spector K, 2004, ANNU REV NEUROSCI, V27, P649, DOI 10.1146/annurev.neuro.27.070203.144220; Hammal Z, 2017, INT CONF AFFECT, P216, DOI 10.1109/ACII.2017.8273603; Haxby JV, 2000, TRENDS COGN SCI, V4, P223, DOI 10.1016/S1364-6613(00)01482-0; Hoffman EA, 2000, NAT NEUROSCI, V3, P80, DOI 10.1038/71152; Horstmann G, 2009, EMOTION, V9, P29, DOI 10.1037/a0014147; Jeni Laszlo A., 2015, 2015 11th IEEE International Conference and Workshops on Automatic Face and Gesture Recognition (FG), P1, DOI 10.1109/FG.2015.7163142; Jeni LA, 2017, IMAGE VISION COMPUT, V58, P13, DOI 10.1016/j.imavis.2016.05.009; Jeni LA, 2014, LECT NOTES COMPUT SC, V8692, P135, DOI 10.1007/978-3-319-10593-2_10; Jeni LA, 2013, INT CONF AFFECT, P245, DOI 10.1109/ACII.2013.47; Katsyri J, 2008, INT J HUM-COMPUT ST, V66, P233, DOI 10.1016/j.ijhcs.2007.10.001; Koelstra S, 2010, IEEE T PATTERN ANAL, V32, P1940, DOI 10.1109/TPAMI.2010.50; Kollias D, 2018, IEEE IJCNN; Le Yang, 2019, 2019 8th International Conference on Affective Computing and Intelligent Interaction (ACII). Proceedings, P538, DOI 10.1109/ACII.2019.8925514; Li W, 2018, IEEE T PATTERN ANAL, V40, P2583, DOI 10.1109/TPAMI.2018.2791608; Li W, 2017, PROC CVPR IEEE, P6766, DOI 10.1109/CVPR.2017.716; Liu CH, 2018, ICMI'18: PROCEEDINGS OF THE 20TH ACM INTERNATIONAL CONFERENCE ON MULTIMODAL INTERACTION, P630, DOI 10.1145/3242969.3264989; Liu J, 2010, J COGNITIVE NEUROSCI, V22, P203, DOI 10.1162/jocn.2009.21203; Liu P, 2014, LECT NOTES COMPUT SC, V8692, P151, DOI 10.1007/978-3-319-10593-2_11; Lu C, 2018, ICMI'18: PROCEEDINGS OF THE 20TH ACM INTERNATIONAL CONFERENCE ON MULTIMODAL INTERACTION, P646, DOI 10.1145/3242969.3264992; Lucey S., 2007, FACE RECOGNITION; Luong T., 2015, P 2015 C EMP METH NA, P1412; Nichols DF, 2010, FRONT PSYCHOL, V1, DOI 10.3389/fpsyg.2010.00028; Onal Ertugrul I., 2019, P BRIT MACH VIS C BM; Pitcher D, 2011, EXP BRAIN RES, V209, P481, DOI 10.1007/s00221-011-2579-1; Rodriguez P, 2018, LECT NOTES COMPUT SC, V11212, P357, DOI 10.1007/978-3-030-01237-3_22; Sanchez, 2018, ARXIV PREPRINT ARXIV; Shao ZW, 2018, LECT NOTES COMPUT SC, V11217, P725, DOI 10.1007/978-3-030-01261-8_43; Shojaeilangari S, 2015, IEEE T IMAGE PROCESS, V24, P2140, DOI 10.1109/TIP.2015.2416634; Taheri S, 2014, IEEE T IMAGE PROCESS, V23, P3590, DOI 10.1109/TIP.2014.2331141; Tian YI, 2001, IEEE T PATTERN ANAL, V23, P97, DOI 10.1109/34.908962; Toser Z, 2016, LECT NOTES COMPUT SC, V9915, P359, DOI 10.1007/978-3-319-49409-8_29; Valstar M, 2016, APPL COMP VIS WACV 2, P1, DOI DOI 10.1109/WACV.2016.7477625; Valstar MF, 2007, LECT NOTES COMPUT SC, V4796, P118; Vielzeuf V., 2017, P 19 ACM INT C MULT, P569, DOI DOI 10.1145/3136755.3143011; Yang P, 2009, PATTERN RECOGN LETT, V30, P132, DOI 10.1016/j.patrec.2008.03.014; Zeng JB, 2015, IEEE I CONF COMP VIS, P3622, DOI 10.1109/ICCV.2015.413; Zhang Z., 2018, BMVC, P1; Zhao KL, 2018, PROC CVPR IEEE, P2090, DOI 10.1109/CVPR.2018.00223; Zhao KL, 2016, PROC CVPR IEEE, P3391, DOI 10.1109/CVPR.2016.369; Zhao KL, 2016, IEEE T IMAGE PROCESS, V25, P3931, DOI 10.1109/TIP.2016.2570550; Zhong L, 2015, IEEE T CYBERNETICS, V45, P1499, DOI 10.1109/TCYB.2014.2354351; Zichao Yang, 2016, P 2016 C N AM CHAPT, P1480	60	7	7	0	0	FRONTIERS MEDIA SA	LAUSANNE	AVENUE DU TRIBUNAL FEDERAL 34, LAUSANNE, CH-1015, SWITZERLAND		2624-9898		FRONT COMP SCI-SWITZ	Front. Comput. Sci.-Switz	NOV 29	2019	1								11	10.3389/fcomp.2019.00011	http://dx.doi.org/10.3389/fcomp.2019.00011			13	Computer Science, Interdisciplinary Applications	Emerging Sources Citation Index (ESCI)	Computer Science	WE9XF	31930192	Green Accepted, gold			2022-10-03	WOS:000705969900001
J	Provenza, NR; Matteson, ER; Allawala, AB; Barrios-Anderson, A; Sheth, SA; Viswanathan, A; McIngvale, E; Storch, EA; Frank, MJ; McLaughlin, NCR; Cohn, JF; Goodman, WK; Borton, DA				Provenza, Nicole R.; Matteson, Evan R.; Allawala, Anusha B.; Barrios-Anderson, Adriel; Sheth, Sameer A.; Viswanathan, Ashwin; McIngvale, Elizabeth; Storch, Eric A.; Frank, Michael J.; McLaughlin, Nicole C. R.; Cohn, Jeffrey; Goodman, Wayne K.; Borton, David A.			The Case for Adaptive Neuromodulation to Treat Severe Intractable Mental Disorders	FRONTIERS IN NEUROSCIENCE			English	Article						responsive neuromodulation; mental disorders; adaptive deep brain stimulation; obsessive compulsive disorder; biomarkers	DEEP BRAIN-STIMULATION; OBSESSIVE-COMPULSIVE DISORDER; VENTRAL CAPSULE/VENTRAL STRIATUM; SUBSTANCE USE DISORDERS; SUBTHALAMIC NUCLEUS; BASAL GANGLIA; PSYCHIATRIC-DISORDERS; ANTERIOR CAPSULOTOMY; BEHAVIORAL-THERAPY; GLOBAL BURDEN	Mental disorders are a leading cause of disability worldwide, and available treatments have limited efficacy for severe cases unresponsive to conventional therapies. Neurosurgical interventions, such as lesioning procedures, have shown success in treating refractory cases of mental illness, but may have irreversible side effects. Neuromodulation therapies, specifically Deep Brain Stimulation (DBS), may offer similar therapeutic benefits using a reversible (explantable) and adjustable platform. Early DBS trials have been promising, however, pivotal clinical trials have failed to date. These failures may be attributed to targeting, patient selection, or the "open-loop" nature of DBS, where stimulation parameters are chosen ad hoc during infrequent visits to the clinician's office that take place weeks to months apart. Further, the tonic continuous stimulation fails to address the dynamic nature of mental illness; symptoms often fluctuate over minutes to days. Additionally, stimulation-based interventions can cause undesirable effects if applied when not needed. A responsive, adaptive DBS (aDBS) system may improve efficacy by titrating stimulation parameters in response to neural signatures (i.e., biomarkers) related to symptoms and side effects. Here, we present rationale for the development of a responsive DBS system for treatment of refractory mental illness, detail a strategic approach for identification of electrophysiological and behavioral biomarkers of mental illness, and discuss opportunities for future technological developments that may harness aDBS to deliver improved therapy.	[Provenza, Nicole R.; Matteson, Evan R.; Allawala, Anusha B.; Borton, David A.] Brown Univ, Sch Engn, Providence, RI 02912 USA; [Provenza, Nicole R.] Charles Stark Draper Lab, Cambridge, MA USA; [Barrios-Anderson, Adriel; McLaughlin, Nicole C. R.] Brown Univ, Psychiat Neurosurg Program, Butler Hosp, Warren Alpert Med Sch, Providence, RI 02912 USA; [Sheth, Sameer A.; Viswanathan, Ashwin] Baylor Coll Med, Dept Neurosurg, Houston, TX 77030 USA; [McIngvale, Elizabeth; Storch, Eric A.; Goodman, Wayne K.] Baylor Coll Med, Menninger Dept Psychiat & Behav Sci, Houston, TX 77030 USA; [Frank, Michael J.] Brown Univ, Dept Cognit Linguist & Psychol Sci, Providence, RI 02912 USA; [Frank, Michael J.; Cohn, Jeffrey] Univ Pittsburgh, Dept Psychol, Pittsburgh, PA 15260 USA; [Borton, David A.] Brown Univ, Carney Inst Brain Sci, Providence, RI 02912 USA; [Borton, David A.] Providence Med Ctr, Ctr Neurorestorat & Neurotechnol, Dept Vet Affairs, Providence, RI 02908 USA		Borton, DA (corresponding author), Brown Univ, Sch Engn, Providence, RI 02912 USA.; Borton, DA (corresponding author), Brown Univ, Carney Inst Brain Sci, Providence, RI 02912 USA.; Borton, DA (corresponding author), Providence Med Ctr, Ctr Neurorestorat & Neurotechnol, Dept Vet Affairs, Providence, RI 02908 USA.	david_borton@brown.edu		Provenza, Nicole R./0000-0002-6952-5417; Barrios-Anderson, Adriel/0000-0002-7150-3938	NIH [1UH3NS100549-01]; McNair Foundation [K23MH100607]; National Science Foundation Graduate Research Fellowship; Draper Fellowship Program; NATIONAL INSTITUTE OF MENTAL HEALTH [K23MH100607] Funding Source: NIH RePORTER; NATIONAL INSTITUTE OF NEUROLOGICAL DISORDERS AND STROKE [UH3NS100549] Funding Source: NIH RePORTER	NIH(United States Department of Health & Human ServicesNational Institutes of Health (NIH) - USA); McNair Foundation; National Science Foundation Graduate Research Fellowship(National Science Foundation (NSF)); Draper Fellowship Program; NATIONAL INSTITUTE OF MENTAL HEALTH(United States Department of Health & Human ServicesNational Institutes of Health (NIH) - USANIH National Institute of Mental Health (NIMH)); NATIONAL INSTITUTE OF NEUROLOGICAL DISORDERS AND STROKE(United States Department of Health & Human ServicesNational Institutes of Health (NIH) - USANIH National Institute of Neurological Disorders & Stroke (NINDS))	This work was supported by NIH (1UH3NS100549-01) (WG, DB, and JC), the McNair Foundation (SS), K23MH100607 (NM), the National Science Foundation Graduate Research Fellowship (AA), and the Draper Fellowship Program (NP).	Afshar P, 2013, FRONT NEURAL CIRCUIT, V6, DOI 10.3389/fncir.2012.00117; Ahmari SE, 2015, DEPRESS ANXIETY, V32, P550, DOI 10.1002/da.22367; Ajiboye AB, 2017, LANCET, V389, P1821, DOI 10.1016/S0140-6736(17)30601-3; Alonso P, 2015, PLOS ONE, V10, DOI 10.1371/journal.pone.0133591; Aron AR, 2007, J NEUROSCI, V27, P3743, DOI 10.1523/JNEUROSCI.0519-07.2007; Barrett K, 2017, BJPSYCH BULL, V41, P281, DOI 10.1192/pb.bp.116.055772; Baskin-Sommers AR, 2015, INT J PSYCHOPHYSIOL, V98, P227, DOI 10.1016/j.ijpsycho.2015.01.011; Bewernick BH, 2012, NEUROPSYCHOPHARMACOL, V37, P1975, DOI 10.1038/npp.2012.44; Boccard SGJ, 2014, NEUROSURGERY, V74, P628, DOI 10.1227/NEU.0000000000000321; Brown LT, 2016, J NEUROSURG, V124, P77, DOI 10.3171/2015.1.JNS14681; Cagnan H, 2017, BRAIN, V140, P132, DOI 10.1093/brain/aww286; Cavanagh JF, 2015, J PHYSIOL-PARIS, V109, P3, DOI 10.1016/j.jphysparis.2014.04.003; Cavanagh JF, 2011, NAT NEUROSCI, V14, P1462, DOI 10.1038/nn.2925; Cavanagh JF, 2010, NEUROIMAGE, V49, P3198, DOI 10.1016/j.neuroimage.2009.11.080; Cleary DR, 2015, NEUROSURG FOCUS, V38, DOI 10.3171/2015.3.FOCUS1546; Cohen MX, 2009, J NEUROSCI, V29, P7591, DOI 10.1523/JNEUROSCI.5335-08.2009; Collins AGE, 2018, P NATL ACAD SCI USA, V115, P2502, DOI 10.1073/pnas.1720963115; Dangi S, 2013, NEURAL COMPUT, V25, P1693, DOI 10.1162/NECO_a_00460; Endrass T, 2014, NEUROSCI BIOBEHAV R, V46, P124, DOI 10.1016/j.neubiorev.2014.03.024; Figee M, 2013, NAT NEUROSCI, V16, P386, DOI 10.1038/nn.3344; Figee M, 2011, BIOL PSYCHIAT, V69, P867, DOI 10.1016/j.biopsych.2010.12.003; Frank MJ, 2015, J NEUROSCI, V35, P485, DOI 10.1523/JNEUROSCI.2036-14.2015; Gehring WJ, 2000, PSYCHOL SCI, V11, P1, DOI 10.1111/1467-9280.00206; Girard JM, 2015, BEHAV RES METHODS, V47, P1136, DOI 10.3758/s13428-014-0536-1; Graat I, 2017, INT REV PSYCHIATR, V29, P178, DOI 10.1080/09540261.2017.1282439; Greenberg BD, 2010, MOL PSYCHIATR, V15, P64, DOI 10.1038/mp.2008.55; Greenberg BD, 2003, NEUROSURG CLIN N AM, V14, P199, DOI 10.1016/S1042-3680(03)00005-6; Greicius M, 2008, CURR OPIN NEUROL, V21, P424, DOI 10.1097/WCO.0b013e328306f2c5; Haber SN, 2013, NEUROPSYCHOPHARMACOL, V38, P252, DOI 10.1038/npp.2012.182; Harris AZ, 2015, ANNU REV NEUROSCI, V38, P171, DOI 10.1146/annurev-neuro-071714-034111; Herron JA, 2017, IEEE T NEUR SYS REH, V25, P2180, DOI 10.1109/TNSRE.2017.2705661; Hofmann SG, 2008, J CLIN PSYCHIAT, V69, P621, DOI 10.4088/jcp.v69n0415; Horschig JM, 2015, PLOS ONE, V10, DOI 10.1371/journal.pone.0138685; Huys QJM, 2016, NAT NEUROSCI, V19, P404, DOI 10.1038/nn.4238; Insel T, 2010, AM J PSYCHIAT, V167, P748, DOI 10.1176/appi.ajp.2010.09091379; Insel TR, 2009, J CLIN INVEST, V119, P700, DOI 10.1172/JCI38832; Jarosiewicz B, 2015, SCI TRANSL MED, V7, DOI 10.1126/scitranslmed.aac7328; Johansen-Berg H, 2008, CEREB CORTEX, V18, P1374, DOI 10.1093/cercor/bhm167; Khanna P., 2015, 2015 IEEE BIOM CIRC, DOI [10.1109/BioCAS.2015.7348348, DOI 10.1109/BIOCAS.2015.7348348]; Kirkby LA, 2018, CELL, V175, P1688, DOI 10.1016/j.cell.2018.10.005; Kisely S, 2014, PSYCHOL MED, V44, P3533, DOI 10.1017/S0033291714000981; Kopell BH, 2008, NEUROSCI BIOBEHAV R, V32, P408, DOI 10.1016/j.neubiorev.2007.07.004; Krystal JH, 2014, CELL, V157, P201, DOI 10.1016/j.cell.2014.02.042; Lega BC, 2011, NEUROREPORT, V22, P795, DOI 10.1097/WNR.0b013e32834b2975; Lehman JF, 2011, J NEUROSCI, V31, P10392, DOI 10.1523/JNEUROSCI.0595-11.2011; Little S, 2013, ANN NEUROL, V74, P449, DOI 10.1002/ana.23951; Locher C, 2017, JAMA PSYCHIAT, V74, P1011, DOI 10.1001/jamapsychiatry.2017.2432; Malone DA, 2009, BIOL PSYCHIAT, V65, P267, DOI 10.1016/j.biopsych.2008.08.029; McLaughlin N.C.R., 2016, PSYCHIAT NEUROTHERAP, P141, DOI [10.1007/978-1-59745-495-7_7, DOI 10.1007/978-1-59745-495-7_7, DOI 10.1007/978-1-59745-495-7]; Milad MR, 2012, TRENDS COGN SCI, V16, P43, DOI 10.1016/j.tics.2011.11.003; Munneke GJ, 2015, BRAIN RES, V1618, P222, DOI 10.1016/j.brainres.2015.05.030; Nambu A., 2014, DEEP BRAIN STIMULATI, P13; Norberg MM, 2008, DEPRESS ANXIETY, V25, P248, DOI 10.1002/da.20298; Pagnoni G, 2002, NAT NEUROSCI, V5, P97, DOI 10.1038/nn802; Peng XL, 2013, PLOS ONE, V8, DOI 10.1371/journal.pone.0079476; Pepper J, 2015, J NEUROSURG, V122, P1028, DOI 10.3171/2014.11.JNS132618; Peters SK, 2016, FRONT SYST NEUROSCI, V10, DOI 10.3389/fnsys.2016.00104; PITMAN RK, 1987, COMPR PSYCHIAT, V28, P334, DOI 10.1016/0010-440X(87)90070-8; Pittenger Christopher, 2005, Psychiatry (Edgmont), V2, P34; Price JL, 2012, TRENDS COGN SCI, V16, P61, DOI 10.1016/j.tics.2011.12.011; Rao VR, 2018, CURR BIOL, V28, P3893, DOI 10.1016/j.cub.2018.10.026; RASMUSSEN SA, 1992, J CLIN PSYCHIAT, V53, P4; Rasmussen SA, 2018, BIOL PSYCHIAT, V84, P355, DOI 10.1016/j.biopsych.2017.11.034; Rauch SL, 2006, J NEUROSURG, V104, P558, DOI 10.3171/jns.2006.104.4.558; Riva-Posse P, 2018, MOL PSYCHIATR, V23, P843, DOI 10.1038/mp.2017.59; Romanelli RJ, 2014, DEPRESS ANXIETY, V31, P641, DOI 10.1002/da.22232; Rosin B, 2011, NEURON, V72, P370, DOI 10.1016/j.neuron.2011.08.023; Ruscio AM, 2010, MOL PSYCHIATR, V15, P53, DOI 10.1038/mp.2008.94; Rush AJ, 2007, AM J PSYCHIAT, V164, P201, DOI 10.1176/appi.ajp.164.2.201; Sani OG, 2018, NAT BIOTECHNOL, V36, P954, DOI 10.1038/nbt.4200; Schmidt R, 2013, NAT NEUROSCI, V16, P1118, DOI 10.1038/nn.3456; Shah Dhwani B, 2008, Psychiatry (Edgmont), V5, P24; Sharma M, 2016, J NEUROSURG SCI, V60, P242; Stanslaski S, 2012, IEEE T NEUR SYS REH, V20, P410, DOI 10.1109/TNSRE.2012.2183617; Steel Z, 2014, INT J EPIDEMIOL, V43, P476, DOI 10.1093/ije/dyu038; Sun FT, 2014, EXPERT REV MED DEVIC, V11, P563, DOI 10.1586/17434440.2014.947274; Tanaka SC, 2004, NAT NEUROSCI, V7, P887, DOI 10.1038/nn1279; Vigo D, 2016, LANCET PSYCHIAT, V3, P171, DOI 10.1016/S2215-0366(15)00505-2; Voon V, 2017, BRAIN, V140, P442, DOI 10.1093/brain/aww309; Walker ER, 2015, JAMA PSYCHIAT, V72, P334, DOI 10.1001/jamapsychiatry.2014.2502; Whelan R, 2012, NAT NEUROSCI, V15, P920, DOI 10.1038/nn.3092; Whiteford HA, 2013, LANCET, V382, P1575, DOI 10.1016/S0140-6736(13)61611-6; Wichmann T, 2006, NEURON, V52, P197, DOI 10.1016/j.neuron.2006.09.022; Widge AS, 2017, EXP NEUROL, V287, P461, DOI 10.1016/j.expneurol.2016.07.021; Widge AS, 2016, J NEUROPSYCH CLIN N, V28, P38, DOI 10.1176/appi.neuropsych.15040089; Wiecki TV, 2015, CLIN PSYCHOL SCI, V3, P378, DOI 10.1177/2167702614565359; Wu H, 2018, P NATL ACAD SCI USA, V115, P192, DOI 10.1073/pnas.1712214114; Zavala BA, 2014, J NEUROSCI, V34, P7322, DOI 10.1523/JNEUROSCI.1169-14.2014	88	25	27	0	1	FRONTIERS MEDIA SA	LAUSANNE	AVENUE DU TRIBUNAL FEDERAL 34, LAUSANNE, CH-1015, SWITZERLAND		1662-453X		FRONT NEUROSCI-SWITZ	Front. Neurosci.	FEB 26	2019	13								152	10.3389/fnins.2019.00152	http://dx.doi.org/10.3389/fnins.2019.00152			9	Neurosciences	Science Citation Index Expanded (SCI-EXPANDED); Social Science Citation Index (SSCI)	Neurosciences & Neurology	LR6KV	30890909	Green Published, gold			2022-10-03	WOS:000535802500001
